Heading,Target,pred_target,dependencia,pred_entidad
GVC Gaesco nombra a Enrique García Palacio nuevo director general del grupo,Enrique García Palacio,Enrique,obj,PER
UGT se opondrá a cualquier cambio que afecte a los prejubilados de Izar,UGT,UGT,nsubj,ORG
Merck sube en  el beneficio neto un   tras desinversiones,Merck,Merck,nsubj,ORG
Los trabajadores de ITP en Sestao y Barakaldo piden una solución in extremis a sus despidos,trabajadores de ITP,trabajadores,nsubj,OTHER
Así ha sido el robo de película de  kg de oro en un aeropuerto de Brasil,robo de película,robo,nsubj,OTHER
La Bolsa de Londres baja un   en la apertura,La Bolsa de Londres,Bolsa,nsubj,OTHER
La luz anticipa mañana otro récord con España congelada,La luz,luz,nsubj,OTHER
Iberdrola inicia este lunes su gran planta fotovoltaica en Usagre Badajoz,Iberdrola,Iberdrola,nsubj,ORG
El PIB frena su crecimiento y se expande un  en el segundo trimestre,El PIB,PIB,nsubj,OTHER
China un dragón asiático que despega,China,China,nsubj,ORG
Pedro Sánchez abrirá foro de la OMT sobre el reto demográfico y el turismo,foro de la OMT,foro,obj,OTHER
Departamento Transporte investiga Boeing en fase final actualizar software,Boeing,Boeing,obj,ORG
Liberbank gana  millones de euros en el primer semestre un  menos,Liberbank,Liberbank,nsubj,ORG
Alcoa alerta de que peligra el futuro de su planta de aluminio en Lugo,Alcoa,Alcoa,nsubj,ORG
Xiaomi distribuye la OTA que soluciona la vulnerabilidad presente en los patinetes Mi Electric Scooter,Xiaomi,Xiaomi,nsubj,ORG
Trump Sin las subidas de tipos de la Fed EEUU habría crecido un  en ,subidas de tipos,None,None,None
Abanca dispuesto a protagonizar una fusión con otra entidad,Abanca,None,None,None
Huawei lo apuesta todo a la fotografía con sus nuevos smartphones,Huawei,Huawei,nsubj,ORG
Nissan ha recibido  millones de ayudas públicas desde  según comité,Nissan,Nissan,nsubj,ORG
Las bolsas del Sudeste Asiático comienzan con resultados mixtos,bolsas del Sudeste Asiático,bolsas,nsubj,OTHER
Maroto anuncia que en septiembre volverán los viajes del Imserso,viajes del Imserso,viajes,nsubj,OTHER
La Bolsa de Lisboa sube el   al cierre,La Bolsa de Lisboa,Bolsa,nsubj,OTHER
Cae la tasa de ahorro de los hogares en  al mínimo histórico,tasa de ahorro,tasa,nsubj,OTHER
Sólo el PSOE se enroca en mantener la subida del impuesto de matriculación,PSOE,PSOE,nsubj,ORG
El precio medio de la vivienda aumentó el   en  según la tasadora ST,precio medio de la vivienda,precio,nsubj,OTHER
Putin apoya a empresarios al inaugurar primera planta MercedesBenz en Moscú,Putin,Putin,nsubj,PER
Siemens Gamesa lanza una nueva plataforma eólica terrestre de  MW,Siemens Gamesa,Siemens,nsubj,ORG
Ghosn va a recibir una jubilación de  euros al año de Renault,Ghosn,Ghosn,nsubj,PER
Canarias impulsa que España sea pionera en autorizar naves de vuelo rasante,España,España,nsubj,LOC
La Bolsa de París baja un   a la apertura,La Bolsa de París,Bolsa,nsubj,OTHER
REE nombra a Concepción Ordiz SEPI vicesecretaria general de la compañía,REE,REE,nsubj,ORG
La vivienda se encarece un   en eurozona y UE en último trimestre de ,La vivienda,vivienda,nsubj,OTHER
Rusia un país con excesiva presencia del Estado e infraestructuras insuficientes,Rusia,Rusia,nsubj,LOC
Euskadi es la única comunidad con repunte del paro en marzo,Euskadi,Euskadi,nsubj,LOC
Fitch mantiene el rating de AdifAV tras una nueva emisión de bonos,Fitch,Fitch,nsubj,ORG
Audi RS Avant la berlina familiar más deportiva de Audi se renueva,Audi RS Avant,Audi,nsubj,MISC
Los ERTE se mantendrán hasta el próximo  de septiembre,Los ERTE,ERTE,nsubj,OTHER
PNV y PSE consideran innecesario un banco público para promover el arraigo empresarial,un banco público,banco,obj,OTHER
Banco Sabadell cierra la venta del   de Solvia a Intrum por  millones,Banco Sabadell,Banco,nsubj,ORG
Tokio  Toyota desarrollará vehículos específicos para los Juegos Olímpicos y Paralímpicos,Toyota,None,None,None
La facturación trimestral del grupo PSA baja un   interanual,grupo PSA,None,None,None
Los españoles conservan pesetas por valor de  millones de euros,Los españoles,españoles,nsubj,OTHER
Huelga en la mayor compañía minera de Mauritania casi paraliza la actividad,mayor compañía minera de Mauritania,None,None,None
Wall Street vuelve a las ventas afectado por la caída del petróleo,Wall Street,Wall,nsubj,LOC
Acuerdan  prejubilaciones en dos empresas de Lladró y siguen negociaciones,Empresas de Lladró,None,None,None
El precio de la gasolina sube un   y el del gasóleo un  ,precio de la gasolina,precio,nsubj,OTHER
Empresa de EEUU alcanza el mayor acuerdo del país en negocio de la marihuana,Empresa de EEUU,Empresa,nsubj,OTHER
Cotización del yuan chino,Cotización del yuan chino,None,None,None
Lyft pierde  millones dólares en primeros resultados tras salida a bolsa,Lyft,Lyft,nsubj,ORG
Los tuits de Trump y las tensiones geopolíticas tumban la Bolsa de Seúl,Los tuits de Trump,tuits,nsubj,OTHER
Los cruceros reabren sus puertas con solo un quinto de su negocio,cruceros,cruceros,nsubj,OTHER
CaixaBank reduce a  las salidas del ERE para alcanzar un acuerdo,CaixaBank,CaixaBank,nsubj,ORG
Rolls quiere acordar la venta de ITP antes del final de septiembre,Rolls,Rolls,nsubj,ORG
Montoro anuncia que emprenderá en plena crisis catalana la mejora de la financiación autonómica,Montoro,Montoro,nsubj,PER
Wall Street cierra en verde y el Dow Jones sube un  ,Wall Street,Wall,nsubj,LOC
Telefónica sale de la Bolsa de Argentina por su escaso volumen de negociación,Telefónica,Telefónica,nsubj,ORG
El precio del crudo de la OPEP baja un   hasta los  dólaresbarril,crudo de la OPEP,None,None,None
Central sindical argentina llama a una huelga general el  de mayo,Central sindical argentina,Central,nsubj,OTHER
Los smartphones podrán sustituir al Meteosat ya colaboran con él,Los 'smartphones',smartphones,nsubj,OTHER
Sacyr batalla en el Tribunal Supremo contra la concesión del aeropuerto de Corvera a Aena,Sacyr,None,None,None
Socio mayoritario de Carige está dispuesto a apoyar una solución de mercado,Socio mayoritario de Carige,Socio,nsubj,OTHER
Thomas Cook cae un   en Bolsa tras multiplicar por seis sus pérdidas,Thomas Cook,Thomas,nsubj,PER
Adif multará a adjudicatarias que pacten concursos con el   del contrato,Adif,Adif,nsubj,ORG
La bolsa de Sao Paulo encadena tercera caída consecutiva en jornada volátil,La bolsa de Sao Paulo,bolsa,nsubj,OTHER
El comité de Tubacex se abre ahora a negociar con la empresa sin condiciones,comité de Tubacex,comité,nsubj,OTHER
Italiana Enel abre parque eólico de  millones dólares en México,Italia Enel,None,None,None
Ana Botín sobre DIA Hemos tratado de llegar a un acuerdo bueno para todos,Ana Botín,Ana,nsubj,PER
La Bolsa de Sao Paulo abre con un avance del   en primeras operaciones,La Bolsa de Sao Paulo,Bolsa,nsubj,OTHER
Sony eleva su apuesta por los juegos la música y el cine en streaming,Sony,Sony,nsubj,ORG
Amancio Ortega enemigo del pueblo según Podemos ha pagado  millones en impuestos desde ,Amancio Ortega,Amancio,nsubj,PER
ELA aboga por mantener la huelga indefinida en Tubacex como garantía para negociar,ELA,ELA,nsubj,ORG
La Bolsa de Buenos Aires abre con un avance del  ,La Bolsa de Buenos Aires,Bolsa,nsubj,OTHER
Siemens Gamesa suministrará  megavatios a un parque de EDF en EEUU,Siemens Gamesa,Siemens,nsubj,ORG
Derechos sociales europeos por favor,Derechos sociales europeos,None,None,None
Ocho de las diez marcas líderes en gran consumo son de origen español,marcas líderes en gran consumo,None,None,None
Santander y Unicaja los bancos favoritos de Goldman Sachs para ganar en bolsa,Santander,Santander,nsubj,LOC
La guerra fría tecnológica entre EEUU y China acentúa el temor de Wall Street,guerra fría tecnológica,guerra,nsubj,OTHER
El petróleo de Texas cae un  y cierra en  dólares el barril,petróleo en Texas,petróleo,nsubj,OTHER
VozTelecom cierra un principio de acuerdo para comprar ComyMedia,VozTelecom,VozTelecom,nsubj,ORG
El euríbor acelera su caída para marcar su media mensual más baja desde noviembre,El euríbor,euríbor,nsubj,OTHER
Presidentes de Nissan y FCA preparan reunión para tratar la oferta a Renault,Presidentes de Nissan y FCA,Presidentes,nsubj,OTHER
Caída de Google y de sus servicios de Gmail y Youtube en EEUU España y otros países europeos,Caída de Google,None,None,None
Lenovo ofrecerá financiación por internet a través de Cetelem,Lenovo,Lenovo,nsubj,ORG
Los riesgos económicos ante la repetición electoral de noviembre,Los riesgos económicos,None,None,None
La Bolsa de Sao Paulo pierde un   en la apertura,Bolsa de Sao Paulo,Bolsa,nsubj,ORG
El Defensor del Pueblo censura el cobro de determinadas comisiones bancarias,El Defensor del Pueblo,Defensor,nsubj,OTHER
La banca cobra comisión de custodia por vender fondos y será deducible,La banca,banca,nsubj,OTHER
Escanear y pagar sin pasar por caja la nueva solución de Repsol,solución de Repsol,solución,obj,OTHER
España en la zona media de la digitalización europea lastrada por la formación y los precios,España,None,None,None
Eudel defiende que la Ley de Aportaciones garantiza más recursos para los ayuntamientos,la Ley de Aportaciones,Ley,nsubj,OTHER
La UE busca pactar la base del presupuesto del euro con frentes aún abiertos,La UE,UE,nsubj,OTHER
La deuda pública marca nuevo récord con  billones de euros hasta marzo,La deuda pública,deuda,nsubj,OTHER
El Gobierno admite que la fortaleza del euro es una amenaza importante para el turismo en España,fortaleza del euro,fortaleza,nsubj,OTHER
Investigadores del MIT desarrollan un sistema para que los robots puedan reconocer un objeto a través del tacto,Investigadores del MIT,Investigadores,nsubj,OTHER
Clece ofertará  puestos laborales en la segunda edición de LaboralMAD,Clece,Clece,nsubj,ORG
Las ventas de HM subieron un   interanual en el segundo trimestre,Las ventas de H&M,ventas,nsubj,OTHER
Estados Unidos y China lideran la lista de superordenadores más potentes del mundo,Estados Unidos,Estados,nsubj,ORG
El Banco de España obligará a los bancos a dotarse de un fondo para evitar otra burbuja,El Banco de España,Banco,nsubj,OTHER
El PSOE registra el martes una propuesta para subir las pensiones con el IPC y animará a más movilizaciones,El PSOE,PSOE,nsubj,OTHER
NetApp busca robar a IBM segundo puesto en almacén de datos en España en ,NetApp,NetApp,nsubj,ORG
Funcas avisa la ralentización económica y la incertidumbre política obstaculizan el cumplimiento del déficit,el cumplimiento del déficit,cumplimiento,obj,OTHER
Luis Gallego compaginará la presidencia de Iberia con la de LEVEL,Luis Gallego,Luis,nsubj,PER
Un juzgado de Valencia reconoce la relación laboral existente entre  riders y Deliveroo,relación laboral,relación,obj,OTHER
NH gestionará los hoteles de Minor en Brasil y Portugal,NH,NH,nsubj,ORG
El IBEX abre con pérdidas del   en una jornada sin referencias de EEUU,El IBEX,IBEX,nsubj,OTHER
El presidente de Portugal visita la primera tienda de Mercadona en el país,Mercadona,None,None,None
El Ibex vuelve a perder el  lastrado por el Brexit y la guerra comercial,El Ibex,Ibex,nsubj,OTHER
Papelón del Gobierno así es el dinero que descubre ahora para las pensiones,Gobiern,None,None,None
Carrefour y Glovo se alían en Francia España Italia y Argentina,Carrefour,Carrefour,nsubj,ORG
Ericcson registró beneficio neto de  millones de euros en primer semestre,Ericcson,Ericcson,nsubj,PER
El BCE concluye que Nordea tiene suficiente capital pero débil sistema datos,Nordea,Nordea,nsubj,ORG
Adif dará el lunes el pistoletazo de salida a la liberalización ferroviaria,Adif,Adif,nsubj,ORG
Continental revisa a la baja sus pronósticos de beneficio y facturación,Continental,Continental,nsubj,ORG
Inquietud en el Banco de España,Banco de España,None,None,None
El Sabadell cree difícil que la banca cobre al particular por los depósitos,El Sabadell,Sabadell,nsubj,OTHER
Cellnex mejora su resultado y cierra el primer semestre en equilibrio,Cellnex,Cellnex,nsubj,ORG
Colonial gana  millones en el primer semestre del año un   más,Colonial,Colonial,nsubj,ORG
Unicaja Banco obtiene un beneficio neto de  millones en el primer semestre un  más,Unicaja Banco,Unicaja,nsubj,ORG
Merlin gana  millones un  menos por la ausencia de extraordinarios,Merlin,Merlin,nsubj,ORG
Merlin gana  millones el   menos tras los extraordinarios de ,Merlin,Merlin,nsubj,ORG
Iberdrola se adjudica el mayor número de lotes en subasta solar de Portugal,Iberdrola,Iberdrola,nsubj,ORG
Ferrovial recorta más de un   sus números rojos hasta  millones,Ferrovial,Ferrovial,nsubj,ORG
CaixaBank lidera venta de fondos de pensiones e inversión colectiva en España,CaixaBank,CaixaBank,nsubj,ORG
Barclays gana  millones de euros en el primer semestre un   más,Barclays,Barclays,nsubj,ORG
El Asistente de Google introduce la lectura de mensajes de apps de mensajería,Asistente de Google,Asistente,nsubj,ORG
Costa anuncia una subida del salario mínimo y avances en reformas estructurales,Costa,Costa,nsubj,LOC
Ryanair al borde de una nueva fuga de personal un año después de perder a más de  pilotos,Ryanair,None,None,None
Colaboración públicoprivada para un pacto de Estado de infraestructuras,Colaboración públic-privada,None,None,None
AliExpress abrirá su primera tienda en España y lo celebrará con descuentos y sorteos,AliExpress,AliExpress,nsubj,ORG
Natra escribe su punto final en bolsa quedará excluida el  de agosto,Natra,Natra,nsubj,PER
Zapatos biodegradables hechos con fibra de plátano made in spain,zapatos biodegradables,None,None,None
Los beneficios corporativos de Japón registran una caída trimestral del  ,beneficios corporativos de Japón,beneficios,nsubj,OTHER
Xunta y sindicatos pedirán la reactivación de la mesa industrial de Alcoa,mesa industrial de Alcoa,None,None,None
La Fiscalía aprecia defectos en la actuación del Banco de España en Bankia,Banco de España,None,None,None
El PIB francés crecerá un  en el tercer trimestre según el BdF,El PIB francés,PIB,nsubj,OTHER
Llerena acogerá una feria que difunde cultura,Llerena,Llerena,nsubj,LOC
Ferrovial recurre la decisión judicial sobre la autopista canadiense ETR,Ferrovial,Ferrovial,nsubj,ORG
Álvarez advierte de que una disrupción del mercado hipotecario perjudicará a clientes y bancos,"""disrupción"" del mercado hipotecario",disrupción,nsubj,OTHER
Wall Street remonta las pérdidas iniciales a la espera de la Fed,Wall Street,Wall,nsubj,LOC
Exconsejeros de Bankia niegan cualquier interés personal en la salida a Bolsa,Exconsejeros de Bankia,Exconsejeros,nsubj,OTHER
Moodys hunde más a OHL en bono basura tras sus pobres resultados trimestrales,Moody,None,None,None
Volotea aumentó un   el número de pasajeros en verano,Volotea,Volotea,nsubj,ORG
Vesuvius se niega a retirar el ERE que afecta a  trabajadores,Vesuvius,Vesuvius,nsubj,PER
Xiaomi presenta Mi Mix Alpha con pantalla envolvente  grados y cámara principal de MP,Xiaomi,Xiaomi,nsubj,ORG
Hacienda tiene un mes para convocar las dos reuniones obligatorias con las CCAA,Hacienda,Hacienda,nsubj,ORG
Volotea transportó a más de tres millones de pasajeros en verano un   más,Volotea,Volotea,nsubj,ORG
El IBEX  sube el   a mediodía a punto de alcanzar el nivel de ,El IBEX,IBEX,nsubj,OTHER
Las aerolíneas ven difícil poder reemplazar a Thomas Cook a corto plazo,Las aerolíneas,aerolíneas,nsubj,OTHER
Las ventas de GM en EEUU aumentaron un   en el tercer trimestre,ventas de GM en EE.UU,ventas,nsubj,OTHER
Declarada en concurso In Destination Incoming tras la quiebra Thomas Cook,In Destination Incoming,None,None,None
EM Grup invertirá  millones en una planta renovable en Cercs Barcelona,EM Grup,EM,nsubj,ORG
Bankinter bonifica planes de pensiones con abono en efectivo de hasta el  ,Bankinter,Bankinter,nsubj,ORG
Twitter y Tweetdeck experimentan problemas que impiden su uso con normalidad,Twitter,Twitter,nsubj,OTHER
Los aranceles por el caso AirbusBoeing encarecerán los billetes según TEDAE,Los aranceles,aranceles,nsubj,OTHER
Madrid tiene unos  proyectos residenciales que sumarán  viviendas,Madrid,Madrid,nsubj,LOC
El Gobierno lanza ayudas por  millones para impulsar el turismo tras la quiebra de Thomas Cook,Gobierno,Gobierno,nsubj,ORG
Alierta presume de su viejo Nokia Soy el único libre ni Google ni Apple ni Facebook saben mi vida,Alierta,Alierta,nsubj,PER
El rey prueba el primer Opel Corsa eléctrico en su visita a Figueruelas,Opel Corsa eléctrico,Opel,obj,OTHER
El IBEX rebota un   pero se queda todavía por debajo de los  puntos,El IBEX,IBEX,nsubj,OTHER
Calviño tendrá que revisar a la baja su previsión de crecimiento del PIB antes del martes,Calviño,Calviño,nsubj,PER
Bolsa Mexicana avanza favorecida por tregua comercial de EEUU y China,Bolsa Mexicana,Bolsa,nsubj,ORG
Rentabilidad y compromiso social motivos para la inversión sostenible,Rentabilidad,None,None,None
El sector químico estima el efecto del brexit en  millones de euros,El sector químico,sector,nsubj,OTHER
Guindos reclama política económica y fiscal para que la munición del BCE vuelva a tener fuerza,política económica y fiscal,política,obj,OTHER
Esfera Robotics un fondo para no perderse la megatendencia de la robotización,Esfera Robotics,None,None,None
Aena adjudica a Sampol la construcción de nueva central eléctrica de Barajas,Sampol,Sampol,obj,LOC
Sánchez responde a los pensionistas que blindará la pensión al IPC real,Sánchez,Sánchez,nsubj,PER
El Big Data  AI Congress constata que la Inteligencia Artificial avanzará el abordaje de enfermedades,la Inteligencia Artificial,Inteligencia,nsubj,OTHER
El sector de componentes para coches ve un  desafiante y preocupante,sector de componentes para coches,sector,nsubj,OTHER
Vértice  eleva un  su beneficio apoyada en el crecimiento de ingresos,Vértice ,Vértice,nsubj,OTHER
Sector de gran consumo acusa políticos de frivolidad tras  años perdidos,Sector de gran consumo,Sector,nsubj,OTHER
Los beneficios de Twitter se hunden un  en el tercer trimestre hasta los  millones,beneficios de Twitter,beneficios,nsubj,OTHER
Las ganancias de Microsoft crecen un  en su primer trimestre hasta  millones,Las ganancias de Microsoft,ganancias,nsubj,OTHER
Mercados en Argentina cierran semana de tensión expectantes a presidenciales,Mercados de Argentina,Mercados,nsubj,OTHER
Los beneficios industriales en China caen un   hasta septiembre,beneficios industriales en China,beneficios,nsubj,OTHER
La campaña de Navidad generará  contratos un   más según Randstad,campaña de Navidad,campaña,nsubj,OTHER
Vento desembarca en Vigo e integra Paseo de Alfonso,Vento,Vento,nsubj,PER
La CNMC rebaja un  las tarifas aeroportuarias de Aena para ,La CNMC,CNMC,nsubj,OTHER
La OMC en manos de Trump,La OMC,None,None,None
Telefónica gana un  menos hasta septiembre tras reestructurar su plantilla,Telefónica,Telefónica,nsubj,ORG
Los centros tecnológicos crecen mientras miran con preocupación la inestabilidad política,Los centros tecnológicos,centros,nsubj,OTHER
Italia busca convencer a ArcelorMittal sobre Ilva que amenaza  empleos,Italia,Italia,nsubj,ORG
Javier Sánchez presidente de las cámaras de comercio,presidente de las cámaras de comercio,None,None,None
Colombia busca empujar a su agroindustria a llenar los supermercados chinos,Colombia,Colombia,nsubj,LOC
Los hoteleros impugnan los pliegos del Imserso por lesionar gravemente sus intereses,pliegos del Imserso,pliegos,obj,OTHER
Bolsa mexicana cierra sin cambios una jornada de bajas en mercados mundiales,Bolsa mexicana,Bolsa,nsubj,OTHER
Avanza la precarización del trabajo en México advierten analistas,precarización del trabajo en México,precarización,nsubj,OTHER
La Bolsa de Sao Paulo no opera este viernes por ser festivo en Brasil,La Bolsa de Sao Paulo,Bolsa,nsubj,OTHER
Viesgo renueva su programa de bonos a corto plazo en la Bolsa de Dublín,Viesgo,Viesgo,nsubj,ORG
Rey saudí dice que venta de acciones de Aramco pagará inversiones prometidas,venta de acciones de Aramco,venta,nsubj,OTHER
Lefties refuerza su internacionalización con su entrada en Túnez,Lefties,Lefties,nsubj,ORG
Novartis llega a un acuerdo para comprar The Medicines Company por  millones de euros,Novartis,Novartis,nsubj,ORG
Los intangibles absorben el  de la inversión en España a la cola de la UE,Los intangibles,intangibles,nsubj,OTHER
El beneficio de las empresas cae un   por las plusvalías de ,beneficio de las empresas,beneficio,nsubj,OTHER
ICEMD celebra  años de formación en Economía Digital del salto al mundo online a la transición hacia la nube,ICEMD,ICEMD,nsubj,ORG
El sector inmobiliario a la cola en sostenibilidad pide objetivos realistas,El sector inmobiliario,sector,nsubj,OTHER
El sector del vapeo culpa a Sanidad de la reducción del  de las ventas,sector del vapeo,sector,nsubj,OTHER
La inversión inmobiliaria cae   por ausencia de operaciones corporativas,La inversión inmobiliaria,inversión,nsubj,OTHER
El Gobierno argentino estudia derogar las jubilaciones de privilegio,El Gobierno Argentino,Gobierno,nsubj,OTHER
Total participará en la mayor central solar fotovoltaica de Catar,Total,Total,nsubj,OTHER
Las startups de Wayra y Telefónica facturan  millones de euros,start-ups,None,None,None
Brexit la incertidumbre persiste dice la City,Brexit,Brexit,nsubj,ORG
La banca fracasa en su soporte clave antes de los resultados,La banca,banca,nsubj,OTHER
Sánchez confía en presentar pronto los Presupuestos de  y negociarlos ya,Sánchez,Sánchez,nsubj,PER
Los trabajadores de Petronor deciden suspender su huelga,trabajadores de Petronor ,trabajadores,nsubj,OTHER
Citigroup planea contratar unos  programadores para ser más competitivo,Citigroup,Citigroup,nsubj,ORG
Hyundai y Uber desarrollarán de forma conjunta un servicio de taxi aéreo,Hyundai y Uber,Hyundai,nsubj,OTHER
El Gobierno impulsará el coche eléctrico subiendo el impuesto de matriculación de los que contaminan,el coche eléctrico,coche,obj,OTHER
Las principales aerolíneas europeas dejan de sobrevolar Irak e Irán,aerolíneas europeas,aerolíneas,nsubj,OTHER
Samsung prevé una caída del  de su beneficio en el cuarto trimestre,Samsung,Samsung,nsubj,ORG
Cellnex emite  millones en bonos para reestructurar su deuda,Cellnex,Cellnex,nsubj,ORG
Walsh cesará como consejero delegado de IAG y Gallego le sucederá en el cargo,Walsh,Walsh,nsubj,PER
Globalvia agotará las acciones legales para que se tenga en cuenta el laudo,Globalvia,Globalvia,nsubj,ORG
La Bolsa de Tokio no opera hoy por ser festivo,La Bolsa de Tokio,Bolsa,nsubj,OTHER
Blockchain para crear un mercado de datos en los puertos,Blockchain,None,None,None
Amazon Microsoft Adidas la lista de la compra de Capital Group para ,Capital Group,None,None,None
El sector TIC mejora sus expectativas de actividad en el corto plazo según Vass y Ceprede,El sector TIC,sector,nsubj,OTHER
Bankinter prevé recuperar en  o  años la aportación de Línea Directa,Bankinter,Bankinter,nsubj,ORG
Bank of America recorta el precio objetivo de Bankia y cree que no cumplirá con el dividendo,Bank of America,Bank,nsubj,ORG
La planta de Nissan en Barcelona dejará de fabricar el pickup de MercedesBenz,planta de Nissan,planta,nsubj,OTHER
El Fondo de Garantía de Depósitos en mínimos tras el desbloqueo de ayudas pendientes a la banca,Fondo de Garantía de Depósito,None,None,None
KPN eleva un  su beneficio en  hasta  millones,KNP,None,None,None
Agencias de viajes recomiendan no viajar a China y facilitar cancelaciones,China,None,None,None
El  del capital privado en España apuesta por la inversión responsable ambiental social y de gobierno,capital privado en España,capital,nsubj,OTHER
División de opiniones entre las CCAA sobre la decisión de Hacienda de dar un mayor margen de déficit tras negar los fondos del IVA,Hacienda,None,None,None
Teleco LAN Party duplicará participantes al celebrarse en el Palacio de Deportes de Cartagena en abril,Teleco LAN Party,Teleco,nsubj,ORG
Firmado el acuerdo para subir el salario mínimo a  euros en ,salario mínimo,salario,obj,OTHER
Gual CaixaBank pide al Gobierno políticas a favor de la creación de empleo,Gual (CaixaBank),Gual,nsubj,OTHER
Banco Santander llevará su modelo de oficina Work Café a Barcelona a finales de febrero,Banco Santander,Banco,nsubj,ORG
Iberdrola se va de Siemens Gamesa cierra la venta de su  por  millones,Iberdrola,Iberdrola,nsubj,ORG
El euro baja a su mínimo desde octubre tras buenos datos de EEUU,El euro,euro,nsubj,OTHER
Fiat Chrysler gana  millones en  un  menos interanual,Fiat Chrysler,Fiat,nsubj,ORG
La industria inmobiliaria demanda a NYork por vetar comisiones a inquilinos,N.York,None,None,None
Iberpapel abrirá este año sus nuevas instalaciones en Hernani Guipúzcoa,Iberpapel,Iberpapel,nsubj,ORG
Opel prevé invertir  millones de euros en una nueva fábrica de baterías,Opel,Opel,nsubj,ORG
TSJM rechaza el recurso de Glovo y encuadra a riders en convenio de reparto,recurso de Glovo,recurso,obj,OTHER
Guerra comercial EEUU acusa a Huawei de conspirar para el robo de secretos comerciales,Huawei,None,None,None
Cinco valores del Continuo que suben un  y mucho más en ,Cinco valores del Continuo,None,None,None
Gobierno y organización chocan por la cancelación del Mobile en juego una alerta sanitaria y el cobro de indemnizaciones,cancelación del Mobile,None,None,None
EEUU aumenta del   al   los aranceles contra Airbus,EE.UU,None,None,None
El IBEX  vuelve a superar  puntos por primera vez desde mayo de ,El IBEX ,IBEX,nsubj,OTHER
Nueva feria tecnológica de Alemania TwentyX presenta su programa,TwentyX,None,None,None
Pallete Telefónica ganó  millones en  un  menos que en ,Pallete,Pallete,nsubj,OTHER
El Ibex enfila su peor semana en un año por el miedo a las nuevas restricciones en Europa,El Ibex,Ibex,nsubj,OTHER
Nueva sentencia del cártel de camiones el juez cuantifica el sobrecoste en el ,cártel de camiones,None,None,None
