Heading,Target,pred_target,dependencia,pred_entidad
BlackRock compra un  BBVA y realiza su mayor apuesta en el banco,BlackRock,BlackRock,nsubj,ORG
Epson renueva sus gafas inteligentes y ahora permiten pilotar drones,Epson,Epson,nsubj,ORG
Volkswagen era consciente del fraude de las emisiones semanas antes de lo admitido,Volkswagen,Volkswagen,nsubj,ORG
Una campaña de la DGT vigilará esta semana a unos  vehículos de transporte escolar, vehículos de transporte escolar,vehículos,obj,OTHER
Jeff Bezos abandona la dirección de Amazon y Andy Jassy será el nuevo CEO del gigante tecnológico,Jeff Bezos,Jeff,nsubj,PER
Volvo arranca una campaña de proximidad en las áreas de influencia de los concesionarios,Volvo,Volvo,nsubj,ORG
El favorito de Trump para representar a EEUU ante la UE prevé el colapso del euro en un año y medio,El favorito de Trump,favorito,nsubj,OTHER
La empresa vasca tiene que creerse más sus capacidades,La empresa vasca,empresa,nsubj,OTHER
Torrot produce  motos en el primer año tras reflotar Gas Gas,Torrot,Torrot,nsubj,PER
Dimiten los tres cargos del Banco de España imputados por el caso Bankia que aún estaban en activo,Banco de España,None,None,None
Lecciones de márketing de Eastwood o Hitchcock,Lecciones de márketing,None,None,None
EDP Renováveis vende unos activos eólicos en Portugal a China Three Gorges por  millones,EDP Renováveis,EDP,nsubj,ORG
De Guindos España será lo más importante para PSA,De Guindos,None,None,None
El PP cuelga el cartel de Se Vende en Génova esto es lo que puede pedir por la sede,PP,PP,nsubj,ORG
Polaroo la startup que quiere convertirse en el gestor digital de todos tus gastos recurrentes,Polaroo,None,None,None
La selección del consejo clave para mejorar el gobierno corporativo,selección del consejo,None,None,None
Si escoges la FP puedes tener un puesto fijo,la FP,FP,obj,OTHER
Zaragoza acoge la jornada de Jóvenes CEDE Talento en crecimiento,Zaragoza,Zaragoza,nsubj,LOC
El Espanyol busca más ingresos comerciales y crear una marca potente en China,El Espanyol,Espanyol,nsubj,OTHER
La Fundación Amancio Ortega dona  millones a la sanidad pública para luchar contra el cáncer,Fundación Amancio Ortega,Fundación,nsubj,ORG
Reyal Urbis evita de nuevo la liquidación al admitirse su propuesta de convenio,Reyal Urbis,Reyal,nsubj,PER
SP mejora la perspectiva de España y abre la puerta a una subida del ráting,perspectiva de España,perspectiva,obj,OTHER
Citadel se suma al fondo AllianceBernstein en su presión bajista contra Enagás,Citadel,Citadel,nsubj,ORG
La Junta pone en marcha un plan con Turespaña para promocionar la región en el exterior,La Junta,Junta,nsubj,OTHER
Mediaset perdió  millones en  y culpa del resultado al grupo francés Vivendi,Mediaset,Mediaset,nsubj,ORG
Así hace Bruselas la lista negra de aerolíneas en la Unión Europea,aerolíneas en la Unión Europea,None,None,None
Andersen Tax  Legal se marca como objetivo contribuir fuertemente al crecimiento internacional de la firma,Andersen Tax & Legal,Andersen,nsubj,OTHER
El empleo en el sector manufacturero aumenta en mayo hasta máximos de  años,empleo en el sector manufacturero,empleo,nsubj,OTHER
Escribano RIElcano En la transición energética habrá países vecinos perdedores,países vecinos,países,obj,OTHER
La venta de suelo cada vez cubre menos de lo que cuesta el Parque Central de Valencia,La venta de suelo,venta,nsubj,OTHER
Fomento tomará medidas para evitar que se especule con las licencias de empresas como Uber,Fomento,Fomento,nsubj,LOC
El Tesoro capta  millones de euros en bonos y obligaciones del Estado,El Tesoro,Tesoro,nsubj,OTHER
Rea vende su  en Europac por  millones tras salir el lunes del capital de Tubacex,Rea,Rea,nsubj,PER
Juan Roig se hace con el cien por cien de Sothis,Juan Roig,Juan,nsubj,PER
El nuevo Renault Mégane RS ofrecerá un sistema de cuatro ruedas directrices,nuevo Renault Mégane R.S,Renault,nsubj,OTHER
La CNMV advierte sobre el chiringuito Plus Trades,La CNMV,CNMV,nsubj,OTHER
Lidl se estrena como inquilino de un centro comercial,Lidl,Lidl,nsubj,ORG
Los ricos merecen menos impuestos que los pobres,"Los ""ricos""",ricos,nsubj,OTHER
El Euríbor vuelve a subir en marzo y se sitúa en torno al ,El Euríbor,Euríbor,nsubj,OTHER
ACS cierra la venta de Cobra a Vinci por  millones,ACS,ACS,nsubj,ORG
El bitcoin cae un  hasta los  dólares tras el veto de pagos en Turquía,el bitcoin,bitcoin,nsubj,OTHER
Las claves de la Bolsa y la agenda del viernes ,claves de la Bolsa,None,None,None
 empresas públicas ya pagan todos los impuestos al Govern, empresas públicas,empresas,nsubj,OTHER
Hochtief recibe sus primeras mejoras de recomendación en plena OPA de Abertis,Hochtief,Hochtief,nsubj,ORG
Los seguros de coche más baratos de octubre,seguros de coche,None,None,None
La Fundación BBVA y la SCIE premian a seis jóvenes investigadores informáticos,La Fundación BBVA,Fundación,nsubj,OTHER
Catalá recibe a la candidatura de Javier Íscar para conocer sus propuestas y reivindicaciones,Catalá,Catalá,nsubj,PER
Repsol mejora un  su beneficio y gana  millones de euros,Repsol,Repsol,nsubj,ORG
Aragón lidera la disminución del paro en España en términos anuales,Aragón,Aragón,nsubj,LOC
El Gobierno podrá invertir a través del IDAE en empresas para impulsar las renovables,El Gobierno,Gobierno,nsubj,OTHER
AG firma a Andrés Allende ex número dos de Paramés para que gestione un fondo,A&G,None,None,None
El fabricante textil nipón Toray revela un nuevo caso de falseo de datos,fabricante textil nipón Toray,fabricante,nsubj,OTHER
Los talleres para Emprender en la Escuela vuelven a los centros aragoneses,"talleres para ""Emprender en la Escuela""",talleres,nsubj,OTHER
Metro de Madrid comienza hoy los paros y critica unos servicios mínimos abusivos,Metro de Madrid,Metro,nsubj,LOC
La socimi de residencias de ancianos Adriano Care debuta en BME Growth el  de mayo,Adriano Care,None,None,None
Al volante del Dacia Duster más completo y ambicioso,Dacia Duster,None,None,None
Rato confía su defensa en el caso Bankia al continuo control de los supervisores,Rato,Rato,nsubj,PER
Donald Trump y el Brexit han dejado de ser comparables,Donald Trump y el Brexit,Donald,nsubj,OTHER
El Ayuntamiento de Badajoz destina más de  euros para rehabilitar el Casco Antiguo,El Ayuntamiento de Badajoz,Ayuntamiento,nsubj,OTHER
La familia Entrecanales reorganiza su participación en el capital de Acciona,La familia Entrecanales,familia,nsubj,OTHER
Bruselas pide a Sánchez una política fiscal prudente por el alto nivel de deuda pública,Sánchez,Sánchez,obj,PER
Goldman Sachs reduce su presencia en Dia hasta el ,Goldman Sachs,Goldman,nsubj,PER
Wall Street consigue el rebote gracias a un dato de empleo más débil de lo esperado,Wall Street,Wall,nsubj,LOC
Uber y Waymo llegan a un acuerdo para cerrar la disputa sobre coches autónomos,Uber y Waymo,Uber,nsubj,OTHER
Gimeno dice que los cambios del ICA entrarán en vigor una vez se apruebe por ley,cambios del ICA,cambios,nsubj,OTHER
Housers amenaza a la CNMV con ir a Competencia para que cese su trato discriminatorio con la plataforma,la CNMV,None,None,None
Acciona construirá una nueva planta de agua en el sur de Ecuador,Acciona,Acciona,nsubj,ORG
La Eurocámara da un visto bueno preliminar a Guindos para ser vicepresidente del BCE,Eurocámara,Eurocámara,nsubj,ORG
Xiaomi Redmi  un smartphone todoterreno por  euros,Xiaomi Redmi ,Xiaomi,nsubj,OTHER
Osborne entra en el mercado de la cerveza artesanal se alía con la empresa productora líder en Amazon,Osborne,Osborne,nsubj,PER
El IDIS reclama que las reversiones en sanidad se justifiquen en términos económicos y asistenciales,El IDIS,IDIS,nsubj,OTHER
Dónde invertir en bolsa hoy Fluidra Prosegur PRIM y Naturgy,invertir en bolsa,None,None,None
ACS inicia la negociación de las nuevas acciones del dividendo flexible,ACS,ACS,nsubj,ORG
Alcoa promete mantener la actividad de la planta de Cervo Lugo sin despidos colectivos hasta julio de ,Alcoa,Alcoa,nsubj,ORG
Castilla y León transita hacia la movilidad eléctrica con la vista en los Next Generation y  millones en incentivos,Castilla y León,Castilla,nsubj,OTHER
Charal El primer IMOCA  con foils de serie toca el agua,Charal,Charal,nsubj,PER
Goldman Sachs adquiere NN Investment Partners por  millones de euros,Goldman Sachs,Goldman,nsubj,PER
El futuro no es Google según el comisario europeo de Ciencia,Google,None,None,None
Google España ganó  millones en  un  menos que el año anterior,Google España,Google,nsubj,ORG
El diálogo social se fractura con el SMI y deja en el aire el pacto de reforma laboral y de pensiones prometido a la UE,El diálogo social,diálogo,nsubj,OTHER
Shotl la startup de movilidad que nació en Barcelona y triunfó en Nueva York,Shotl,Shotl,nsubj,PER
El lujo inmobiliario español cotiza al alza en Europa,lujo inmobiliario español,lujo,nsubj,OTHER
Tamaño y sector los motivos detrás de las acusadas diferencias en digitalización de las empresas españolas,Tamaño y sector,None,None,None
General Motors se dispara en Wall Street tras mejorar su previsión de beneficios,General Motors,General,nsubj,ORG
El Ibex recupera los  el PSOE no baraja fecha para un adelanto electoral y otras noticias del día,El Ibex,Ibex,nsubj,OTHER
Santander se alía con IBM para acelerar su transformación digital y reducir costes,Santander,Santander,nsubj,LOC
Range Rover Sport HST MHEV un seis cilindros de  CV con etiqueta ECO,Range Rover Sport,Range,nsubj,OTHER
BBVA unificará su marca en todo el mundo para crecer en servicios digitales,BBVA,BBVA,nsubj,ORG
Ence sufre su primera crisis tras el regreso al Ibex,Ence,Ence,nsubj,ORG
Iván Delgado Los inversores tendrán en cuenta si se suben o no los impuestos en España,Los inversores,None,None,None
Abanca gana  millones de euros en el primer semestre un  más,Abanca,Abanca,nsubj,ORG
Alquilar un piso compartido en Aragón cuesta de media de  euros al mes,Alquilar un piso compartido,piso,obj,OTHER
Accenture compra la firma española de big data Pragsis Bidoop,Accenture,Accenture,nsubj,ORG
Guerra fría MSC crea un almacén refrigerado en la ZAL tras comprar Agro Merchants Fríopuerto,MSC,None,None,None
Caídas para el ethereum pese al optimismo tras los máximos de  días,el ethereum,None,None,None
Jordi Gual La situación ha empeorado pero no necesitamos modificar los objetivos del plan estratégico,Jordi Gual,Jordi,nsubj,PER
El Corte Inglés incorpora el sistema de pago WeChat Pay usado por  millones de chinos,El Corte Inglés,Corte,nsubj,OTHER
La financiación vía mercados se acerca al  máximo histórico,financiación vía mercados,financiación,nsubj,OTHER
El Banco Mundial alerta del rápido y generalizado aumento de la deuda,Banco Mundial,Banco,nsubj,ORG
Empresarios e instituciones solicitan adelantar la hora del AVCity Zaragoza  Madrid,Empresarios ,Empresarios,nsubj,OTHER
Iberdrola acelera las megadonaciones del Ibex con  millones de euros,Iberdrola,Iberdrola,nsubj,ORG
Mercadona logra líneas de liquidez de  millones para pagar a proveedores,Mercadona,Mercadona,nsubj,ORG
La producción industrial repunta un  en febrero tras caer enero,producción industrial,producción,nsubj,OTHER
Los autónomos cobrarán la devolución de la cuota de marzo en la segunda quincena de mayo,Los autónomos,autónomos,nsubj,OTHER
Isern Patentes y Marcas presenta un ERTE,Isern Patentes y Marcas,Isern,nsubj,OTHER
Airbus plantea un ERTE para sus centros de Getafe Illescas y Puerto Real,Airbus,Airbus,nsubj,ORG
Los Charts de Hódar Acciona CIE Automotive y Telefónica,Charts de Hódar,None,None,None
Macron veta el cierre de plantas de Renault en Francia,Macron,Macron,nsubj,ORG
UGT pide que el derecho a la salud sea una prioridad en la reincorporación al trabajo,UGT,UGT,nsubj,ORG
Los inversores se preguntan si la cartera  tiene futuro,inversores,inversores,nsubj,OTHER
Guindos BCE el PIB no volverá a niveles pre Covid hasta finales de ,el PIB,None,None,None
La compraventa de viviendas repunta un  en el primer trimestre,compraventa de viviendas,compraventa,nsubj,OTHER
Youtube no viola los derechos de autor por las obras subidas de manera ílícita por sus usuarios,Youtube,Youtube,nsubj,ORG
La economía valenciana crecerá este año un  según Hispalink,La economía valenciana,economía,nsubj,OTHER
La inflación se ha disparado y no saben como contenerla O si,La inflación,inflación,nsubj,OTHER
Financiación Autonómica  III,Financiación Autonómica,None,None,None
La asesoría Afiris cumple  años,La asesoría Afiris,asesoría,nsubj,OTHER
Los bufetes fichan a periodistas ingenieros psicólogos y químicos,Los bufetes,bufetes,nsubj,OTHER
Crecen las consultas legales de ciudadanos sobre Internet,consultas legales de ciudadanos,consultas,nsubj,OTHER
Industria apoya la actividad de la Fundación Centro de Ciencias de Benasque Pedro Pascual,Industria,Industria,nsubj,MISC
La CNMV alerta sobre otros cinco chiringuitos financieros,CNMV,CNMV,nsubj,ORG
Deutsche Bank cerrará un  de sus oficinas y venderá Postbank para ahorrar  millones,Deutsche Bank,Deutsche,nsubj,ORG
Manzano pide a los extremeños que remen en la misma dirección y confíen en el proyecto integrador de Monago,Manzano,Manzano,nsubj,PER
Aer Lingus aumentó un  sus ingresos en el primer trimestre,Aer Lingus,Aer,nsubj,MISC
Los  magníficos de Repsol, magníficos de Repsol,None,None,None
Abengoa vende activos renovables a su filial estadounidense por  millones,Abengoa,Abengoa,nsubj,ORG
Deutsche Telekom reduce su beneficio un  pero bate las previsiones,Deutsche Telekom,Deutsche,nsubj,ORG
El capital riesgo busca nuevos Facebook en la universidad,El capital riesgo,capital,nsubj,OTHER
Banco Madrid intenta frenar la fuga de empleados,Banco Madrid,Banco,nsubj,ORG
La CNMV multa a Euroinnova accionista de Dermoestética,Euroinnova,Euroinnova,obj,ORG
Rudi señala que la estabilidad no tiene atajos ni milagros,la estabilidad,estabilidad,nsubj,OTHER
Arabia Saudí aspira a convertirse en una potencia en energía eólica y solar,Arabia Saudí,Arabia,nsubj,LOC
La justicia de EEUU acusa a la FIFA de aceptar sobornos,FIFA,None,None,None
Los billetes de  euros en circulación marcan mínimos históricos en abril,billetes de  euros,billetes,nsubj,OTHER
La CE abre una consulta para mejorar la banda ancha en la UE,La CE,CE,nsubj,OTHER
Kirchner pone más condiciones para el giro de dividendos al exterior,Kirchner,Kirchner,nsubj,PER
HTC presentará su nuevo smartphone y su primer smartwatch en marzo,HTC,HTC,nsubj,ORG
ACS inicia con buen pie la OPV de Saeta,ACS,ACS,nsubj,ORG
ATT adquiere Nextel México por  millones de dólares,AT&T,None,None,None
Acciona ve imposible adjudicar el contrato de ATLL a Agbar,Acciona,Acciona,nsubj,ORG
FCC relanza su negocio de concesiones tras vender Globalvia,FCC,FCC,nsubj,ORG
JP Morgan el PIB de España crecerá un  en ,el PIB,None,None,None
Shikku Izakaya lanza una carta de carne wagyu,Shikku Izakaya,Shikku,nsubj,PER
BBVA coloca  millones de euros en CoCos al ,BBVA,BBVA,nsubj,ORG
Un nuevo lenguaje para las ofertas de empleo,Un nuevo lenguaje,None,None,None
Un ex directivo de General Motors recomienda a Apple que no desarrolle un coche,ex directivo de General Motors,directivo,nsubj,OTHER
El Gobierno adelantará un segundo pago del rescate bancario este año,El Gobierno,Gobierno,nsubj,OTHER
Gana dinero como celebrity de las redes,celebrity' de las redes,None,None,None
HolaMOBI adquiere Movilredpublic y abre la puerta a nuevas compras,HolaMOBI,HolaMOBI,nsubj,ORG
Broseta impulsa procesal y arbitraje con Jesús Giner,Broseta,Broseta,nsubj,PER
Ibercaja pospone la plena recuperación económica a ,Ibercaja,Ibercaja,nsubj,ORG
Alcoa ofrece seguir fabricando aluminio en España a cambio de un cese de dos años y rebajas eléctricas,Alcoa,Alcoa,nsubj,ORG
El Banco de España cree que la reforma de pensiones no basta para cubrir costes,El Banco de España,Banco,nsubj,OTHER
El juez acusa al exdirector general de CAM y a otro exdirectivo de dietas y préstamos irregulares,exdirector general de CAM,exdirector,obj,OTHER
Metrovacesa pagará un dividendo de  euros el  de diciembre,Metrovacesa,Metrovacesa,nsubj,ORG
BeMate como primera respuesta del negocio tradicional a los colaborativos,BeMate,None,None,None
El interés del bono de Portugal baja del  por primera vez desde ,interés del bono de Portugal,interés,nsubj,OTHER
Sacyr y el Canal de Panamá acercan posturas para continuar las obras,Sacyr,Sacyr,nsubj,ORG
El GobEx subvenciona proyectos de conservación de la naturaleza con hasta  euros,El GobEx,GobEx,nsubj,OTHER
La Reina y la Princesa de Asturias cobrarán un sueldo fijo anual,La Reina,Reina,nsubj,OTHER
Apple compensa la falta de ilusión de Wall Street comprándose sus propios títulos por  millones de dólares,Apple,Apple,nsubj,ORG
Vodafone compra frecuencias en India por  millones,Vodafone,Vodafone,nsubj,ORG
Pioneer lanza dos fondos alternativos con liquidez diaria,Pioneer,Pioneer,nsubj,ORG
Extremadura se integra en el Año Dual comercial EspañaJapón,Extremadura,Extremadura,nsubj,LOC
Los expertos recomiendan que Latinoamérica haga reformas para mejorar su economía,Latioamérica,None,None,None
Samsung presenta el Galaxy S más rápido y resistente al agua y al polvo,Samsung,Samsung,nsubj,ORG
La fuerza de los bonos europeos aumenta,bonos europeos,None,None,None
WhatsApp sufre un fallo de seguridad que permite a los hackers leer conversaciones,WhatsApp,WhatsApp,nsubj,ORG
BNP Paribas suprimirá cerca de  empleos en su filial ucraniana,BNP Paribas,BNP,nsubj,ORG
FCC duplica su cartera en Costa Rica tras lograr  contratos por  millones de euros,FCC,FCC,nsubj,ORG
Telefónica anuncia el cierre y desembolso de dos emisiones de deuda perpetua por  millones,Telefónica,Telefónica,nsubj,ORG
El Grupo Arturo vende un colegio en Madrid por  millones,El Grupo Arturo,Grupo,nsubj,OTHER
Steve Jobs prometió una guerra santa contra Google,Steve Jobs,Steve,nsubj,PER
La Feria del Mueble cierra con una asistencia de  personas,La Feria del Mueble,Feria,nsubj,OTHER
Bankia cierra la venta del  de Ribera Salud a Centene,Bankia,Bankia,nsubj,ORG
El PSOE vaticina menos seguros agrarios con las ayudas del Gobierno regional,El PSOE,PSOE,nsubj,OTHER
El euro acelera sus subidas frente al dólar la Fed neutraliza al BCE,El euro,euro,nsubj,OTHER
DuPont recorta un  el beneficio,DuPont,DuPont,nsubj,ORG
Ford gana un  menos por los costes de reestructuración,Ford,Ford,nsubj,ORG
GE califica de positiva la reunión con Hollande sobre Alstom,GE,GE,nsubj,ORG
UGT relaciona el descenso del paro con la reducción de la población activa,descenso del paro,descenso,obj,OTHER
Madrileños y vascos en el ojo del huracán de las subidas del euribor,Madrileños,None,None,None
Fitch confirma los ratings BBB con perspectiva estable de Valencia Andalucía y Canarias,ratings 'BBB-',ratings,obj,OTHER
Las nuevas acciones de Liberbank cotizarán el  de junio,Liberbank,None,None,None
Montoro asegura que los datos del paro de mayo serán mejores que los de abril,paro,None,None,None
Los consejos de Bruselas ajuste fiscal más allá de  y más reforma laboral,consejos de Bruselas,consejos,nsubj,OTHER
Agbar sale de la empresa de agua de Marina dOr,Agbar,Agbar,nsubj,ORG
Line pide cambiar las contraseñas aunque asegura no haber sido hackeada,Line,Line,nsubj,ORG
Botín sostiene que una reforma fiscal bien hecha es fundamental para aumentar competitividad y mejorar paro,reforma fiscal,reforma,nsubj,OTHER
Los deportistas establecidos en España tendrán que tributar como residentes,deportistas establecidos en España,deportistas,nsubj,OTHER
Hacienda y las CCAA analizan el jueves la reforma fiscal y los objetivos de déficit,Hacienda,Hacienda,nsubj,ORG
El Banco de Inglaterra pone un drástico límite a las hipotecas para pinchar la burbuja inmobiliaria,El Banco de Inglaterra,Banco,nsubj,OTHER
 ejecuciones hipotecarias sobre viviendas en Extremadura en el primer trimestre, ejecuciones hipotecarias,None,None,None
La retención de los autónomos bajará al  para los que cobren como máximo  euros,retención de los autónomos,retención,nsubj,OTHER
Telefónica cierra la compra del  de Canal a Mediaset,Telefónica,Telefónica,nsubj,ORG
Cien ganaderos de porcino de Teruel se beneficiarán de las ayudas al transporte de purines,Cien ganaderos de porcino,ganaderos,nsubj,OTHER
Brufau Imaz y el consejo de Repsol cobran el dividendo en acciones,"Brufau, Imaz y el consejo de Repsol",Brufau,nsubj,OTHER
Boeing eleva un  el beneficio y mejora su previsión anual,Boeing,Boeing,nsubj,ORG
El ICO no descarta recurrir a la inyección de liquidez del BCE,El ICO,ICO,nsubj,OTHER
La economía catalana crecerá por encima del  en ,La economía catalana,economía,nsubj,OTHER
La ONCE y su Fundación impulsan en Aragón  empleos en ,La ONCE,ONCE,nsubj,OTHER
Merlin Properties compra un edificio en Barcelona por  millones,Merlin Properties,Merlin,nsubj,ORG
Wall Street acaba con el SP en máximos con el Dow por encima del ,Wall Street,Wall,nsubj,LOC
El Tesoro emitirá mañana hasta  millones en letras a tres y nueve meses,El Tesoro,Tesoro,nsubj,OTHER
Bruselas recuerda a Francia su compromiso de mantener reformas,Bruselas,Bruselas,nsubj,ORG
Las ventas de coches crecen en Euskadi un  en agosto,Las ventas de coches,ventas,nsubj,OTHER
Roche despedirá a unos  empleados en España,Roche,Roche,nsubj,PER
El presidente de Danone pasa las riendas ejecutivas a Emmanuel Faber,presidente de Danone,presidente,nsubj,OTHER
Ana Botín garantiza su máximo esfuerzo para mantener la trayectoria de éxito de Santander,Ana Botín,Ana,nsubj,PER
La confianza empresarial cae en Alemania en septiembre por quinto mes,La confianza empresarial,confianza,nsubj,OTHER
Los bancos detectan un aumento de la demanda solvente y prevén que irá a más,la demanda solvente,None,None,None
Las pérdidas de Motorland en  se compensarán con los  millones que genera,Motorland,None,None,None
España es el tercer país de la UE donde más cae el paro aunque sigue creciendo el de larga duración,España,España,nsubj,LOC
Fernández de Sousa prestó  millones a su mujer para llevarlos a China,Fernández de Sousa,Fernández,nsubj,PER
Mercadona quiere abrir otras  tiendas en España anuncia Juan Roig,Mercadona,Mercadona,nsubj,ORG
Fundaciones CAI e Ibercaja destinan  euros a Aldeas Infantiles Aragón,Fundaciones CAI,Fundaciones,nsubj,ORG
Hacienda se inclina por mantener el golpe fiscal a la vivienda,Hacienda,Hacienda,nsubj,ORG
Confianza en Draghi y desconfianza en los mercados,Draghi,None,None,None
Las bajas por enfermedad profesional aumentan un ,bajas por enfermedad,bajas,nsubj,OTHER
ACS gana  parques fotovoltaicos en Brasil por  millones de euros,ACS,ACS,nsubj,ORG
Las Cortes analizan las previsiones de gasto de Agricultura y Educación para ,Las Cortes,Cortes,nsubj,OTHER
Las acciones de Inditex se recuperan tras el varapalo del martes,Las acciones de Inditex,acciones,nsubj,OTHER
EY y KPMG competirán con PwC por la auditoría de la OPV de Aena,auditoría de la OPV de Aena,None,None,None
La OPEP no recorta producción pese al desplome del precio del petróleo,La OPEP,OPEP,nsubj,OTHER
Lone Star avanza en la compra de la inmobiliaria de Kutxabank,Lone Star,Lone,nsubj,ORG
El número de parados desciende en Aragón en  personas en noviembre,número de parados en Aragón,número,nsubj,OTHER
Las exportaciones alemanas baten en octubre su récord,Las exportaciones alemanas,exportaciones,nsubj,OTHER
La Generalitat gestionará los terrenos de BCN World mientras se concretan inversores,La Generalitat,Generalitat,nsubj,OTHER
Gobierno y agentes sociales firman mañana la nueva ayuda a parados,Gobierno,Gobierno,nsubj,ORG
Renta Corporación culmina la ampliación que ha convertido a Sareb en accionista,Renta Corporación,Renta,nsubj,ORG
El rublo recupera más de un  frente al dólar en una semana,El rublo,rublo,nsubj,OTHER
Cómo apuntarse a las más de  ofertas de Empléate antes de que cambie el portal del SEPE se reconvertirá,portal de SEPE,portal,nsubj,OTHER
Los factores que sí se valorarán en el futuro para conseguir un empleo,empleo,empleo,obj,OTHER
Seis municipios de Valencia y uno de Castellón pagaron la extra de Navidad a los funcionarios,municipios de Valencia,municipios,nsubj,OTHER
Repsol pagara hasta  millones en acciones a sus empleados,Repsol,Repsol,nsubj,ORG
El Tribunal de Estrasburgo confirma la ilegalización de la formación ANV,El Tribunal de Estrasburgo,Tribunal,nsubj,OTHER
Airbus vende  aviones a una filial de Bank of China por  millones,Airbus,Airbus,nsubj,ORG
Gandía última parada de la guerra legal entre Aguas de Valencia y Agbar,Gandía,Gandía,nsubj,LOC
Acciona contraataca y recurre ante el TSJC su exclusión del concurso de ATLL,Acciona,Acciona,nsubj,ORG
Telefónica recortará un  de su plantilla en la República Checa,Telefónica,Telefónica,nsubj,ORG
EDreams coloca una emisión de bonos de  millones de euros,EDreams,EDreams,nsubj,ORG
Detenidos en Lloret de Mar  presuntos miembros de la mafia rusa por blanquear  millones,mafia rusa,None,None,None
Ayudas sí pero sin límite de edad,Ayudas,None,None,None
La Gran Dimisión no llega a España pese a la frustración de parte de los trabajadores,La Gran Dimisión,Gran,nsubj,OTHER
Apuesta por la ecología para crear tu negocio,la ecología,ecología,obj,OTHER
Westinghouse Iberdrola y Gas Natural construirán el almacén nuclear,Westinghouse,Westinghouse,nsubj,OTHER
Seat León FR un gran salto adelante,Seat León FR,None,None,None
Los acreedores de Reyal Urbis tienen un mes a partir de hoy para comunicar sus créditos,acreedores de Reyal Urbis,acreedores,nsubj,OTHER
Minoritarios de Cassa denuncian a cinco consejeros por falta de imparcialidad en la opa de Agbar,cinco consejeros,consejeros,obj,OTHER
Se mantienen los diez días de apertura de comercios en festivo en el ,apertura de comercios,None,None,None
Deoleo fija en  euros el pago a las preferentes que no hayan acudido a la oferta de recompra,Deoleo,Deoleo,nsubj,ORG
