Heading,Target,pred_target,dependencia,pred_entidad
Apple da el salto al G con el iPhone ,Apple,Apple,nsubj,ORG
Bankinter gana  millones hasta septiembre un  menos,Bankinter,Bankinter,nsubj,ORG
Vueling garantiza el empleo de todos sus pilotos hasta el final de ,Vueling,Vueling,nsubj,ORG
La actividad empresarial de la zona euro se contrajo en octubre por el empeoramiento de la epidemia,actividad empresarial de la zona euro,actividad,nsubj,OTHER
Inditex firma un acuerdo para mantener el empleo con la transformación digital de la empresa,Inditex,Inditex,nsubj,ORG
Macron renuncia a su pensión vitalicia para dar ejemplo,Macron,Macron,nsubj,ORG
Así evoluciona el precio de la vivienda usada,precio de la vivienda usada,precio,nsubj,OTHER
El gestor Bill Ackman hace una nueva apuesta contra el crédito corporativo,Bill Ackman,None,None,None
La segunda ola del coronavirus desploma un  el tráfico de los aeropuertos en España,segunda ola del coronavirus,ola,nsubj,OTHER
La fiscalidad del automóvil se atasca en cinco carteras ministeriales,fiscalidad del automóvil,fiscalidad,nsubj,OTHER
El Gobierno aprueba hoy bajar el IVA de las mascarillas al  y ampliar los avales del ICO,El Gobierno,Gobierno,nsubj,OTHER
Las inmobiliarias se lanzan a comprar supermercados por  millones,Las inmobiliarias,inmobiliarias,nsubj,OTHER
Santander reivindica el papel de la banca en la recuperación,Santander,Santander,nsubj,LOC
El deporte alcanza el  del PIB español y genera  empleos,El deporte,deporte,nsubj,OTHER
País Vasco CastillaLa Mancha y Madrid se salvan de la debacle del paro en noviembre,País Vasco,País,nsubj,LOC
El Covid recorta en  millones el beneficio de las cotizadas catalanas,El Covid-,Covid,nsubj,OTHER
Francia prepara hasta  millones de ayuda a Air France para la primavera según RTL,Francia,Francia,nsubj,ORG
OLeary no ve claro el futuro de IAG como dueña de British Airways tras el Brexit,futuro de IAG,futuro,obj,OTHER
Xavier Labandeira España es uno de los países más vulnerables al cambio climático,España,None,None,None
Dia ficha al exdirector financiero de Vips e incorpora al consejo a su responsable en Brasil,Dia,Dia,nsubj,OTHER
El salario mínimo ante la fragilidad empresarial,El salario mínimo,None,None,None
Los inversores fuerzan la salida del CEO de Rio Tinto tras la destrucción de yacimientos aborígenes,Los inversores,inversores,nsubj,OTHER
Vuelve el vértigo a los inversores en IAG y las aerolíneas europeas,inversores en IAG,inversores,obj,OTHER
Así se gastarán los  primeros millones de los fondos europeos,. primeros millones,millones,nsubj,OTHER
 el año del Fénix,año del Fénix,None,None,None
Los cuatro fondos de Bolsa que ganan más del ,fondos de Bolsa,None,None,None
Todo sobre la Sociedad Limitada de Formación Sucesiva,Sociedad Limitada de Formación Sucesiva,None,None,None
Deutsche Bank dejará de hacer nuevos negocios con Trump tras décadas de colaboración,Deutsche Bank,Deutsche,nsubj,ORG
El bono americano ya deja pérdidas del  en el año,bono americano,bono,nsubj,OTHER
La SEC investiga a Exxon por la valoración de sus activos de la Cuenca Pérmica,Exxon,Exxon,obj,ORG
El arte contemporáneo se encarece un  según Artprice,El arte contemporáneo,arte,nsubj,OTHER
Fitch mantiene la nota de la deuda griega en BB con perspectiva estable,la deuda griega,None,None,None
Crece el temor ante una burbuja tecnológica y los hedge funds se hacen fuertes en plena pandemia,burbuja tecnológica,None,None,None
El fondo de recuperación de la UE va demasiado lento según el ministro de economía francés,fondo de recuperación de la UE,fondo,nsubj,OTHER
Peligroso atasco en los fondos que invierten en renovables,fondos que invierten en renovables,que,nsubj,OTHER
España a la cola en la concesión de ayudas públicas en Europa destina solo el  del PIB,España,España,nsubj,ORG
Los economistas critican el plazo de entrada en vigor de la Ley de Auditoría,Ley de Auditoría,None,None,None
Renfe pierde  millones tras un año sin apenas viajeros en el AVE,Renfe,Renfe,nsubj,ORG
El Banco de Inglaterra no mueve ficha pero anuncia una recuperación muy rápida de la economía en ,El Banco de Inglaterra,Banco,nsubj,OTHER
Santander aprueba la salida a Bolsa de Getnet para impulsar su nueva plataforma de pagos PagoNxt,Santander,Santander,nsubj,LOC
Alcampo amplía capital tras culminar su reestructuración societaria en España,Alcampo,Alcampo,nsubj,ORG
 puestos cotizados para trabajar en  sectores emergentes, puestos cotizados,None,None,None
Gransolar explora su venta por hasta  millones,Gransolar,Gransolar,nsubj,ORG
Así es el plan del Gobierno para salvar empresas quitas y entrar en el capital,plan del Gobierno ,plan,nsubj,OTHER
Restaurantes elásticos para sobrevivir,Restaurantes elásticos,None,None,None
Three Gorges cierra la compra de las renovables de los Masaveu,Three Gorges,Three,nsubj,PER
Los analistas apuntan a que Telefónica bajará el dividendo para mejorar su posición financiera,Telefónica,Telefónica,nsubj,ORG
España el país de la Unión Europea donde más crece la desigualdad salarial,España,España,nsubj,LOC
Las lagunas legislativas sobre la intervención de las CCAA amenazan la eficacia de los Perte,lagunas legislativas,lagunas,nsubj,OTHER
Aena destinará al menos  millones de euros a ampliar El Prat a partir de ,Aena,Aena,nsubj,ORG
La CNMV exige a Barón de Ley que actualice el informe de valoración para aprobar su opa,La CNMV,CNMV,nsubj,OTHER
Richi Arambarri Vintae La empresa no está para que vivamos mejor,La empresa,None,None,None
Stripe el mayor unicornio de Silicon Valley tras ser valorada en  millones de dólares,Stripe,Stripe,nsubj,MISC
Cinco valores triplican la recuperación del Ibex en los últimos  meses,Ibex,None,None,None
Wikipedia lanzará su versión de pago para empresas a final de año,Wikipedia,Wikipedia,nsubj,ORG
Samsung lanza dos nuevos smartphones de gama media con mejores pantallas y G,Samsung,Samsung,nsubj,ORG
Juicio a la moratoria concursal,moratoria concursal,None,None,None
Bolsa las mejores opciones para el rally automovilístico,rally' automovilístico,None,None,None
Los Charts de Hódar CaixaBank Sabadell y Mapfre,Charts de Hódar,None,None,None
El Ibex salva los  puntos gracias al giro alcista en Wall Street,Ibex,Ibex,nsubj,ORG
El asistente oficial de Hacienda cuyas soluciones podrás descargar en PDF,asistente oficial de Hacienda,None,None,None
El Banco de España pide a la banca que use los colchones de capital para los deterioros,Banco de España,Banco,nsubj,ORG
El expresidente de la CNMV Sebastián Albella se incorpora a Latham  Watkins,expresidente de la CNMV Sebastián Albella,expresidente,nsubj,OTHER
Codere pide  millones más a sus bonistas y estudia capitalizar parte de su deuda,Codere,Codere,nsubj,ORG
CaixaBank iniciará este lunes la unificación de la marca en su red de oficinas,CaixaBank,CaixaBank,nsubj,ORG
Las trabajadoras en ERTE no pueden cobrar la prestación por riesgo en el embarazo,Las trabajadoras en ERTE,trabajadoras,nsubj,OTHER
Francia dará primas a los que desguacen su coche para comprar una bicicleta,Francia,Francia,nsubj,LOC
Cellnex cierra su macroampliación de capital con fuerte demanda,Cellnex,Cellnex,nsubj,ORG
Meliá trabaja en China con ocupaciones que llegan incluso al ,Meliá,Meliá,nsubj,PER
El Gobierno se compromete a subir las pensiones conforme al IPC y no habrá compensaciones por inflación negativa,El Gobierno,Gobierno,nsubj,OTHER
Openbank nuevo patrocinador oficial del Mutua Madrid Open,Openbank,Openbank,nsubj,ORG
Cellnex salta mañana al cuarto puesto por capitalización,Cellnex,Cellnex,nsubj,ORG
ETL lanza Medvision para el colectivo médico,Medvision,Medvision,obj,MISC
Renfe suspende una licitación de  millones por contaminante,Renfe,Renfe,nsubj,ORG
Catarata de subidas de impuestos y nuevas tasas para este año y ,impuestos y nuevas tasas,None,None,None
Las aseguradoras verán reducida su red bancaria en  oficinas,Las aseguradoras,aseguradoras,nsubj,OTHER
Ferrovial y Acciona impugnan el principal contrato de Colau,Ferrovial,Ferrovial,nsubj,ORG
CaixaBank planea igualar las condiciones laborales de su plantilla y la de Bankia,CaixaBank,CaixaBank,nsubj,ORG
Los usuarios del transporte público aumentaron un  en marzo la primera subida en pandemia,usuarios del transporte público,usuarios,nsubj,OTHER
Subida contenida en  en A Coruña y Vigo,Subida contenida,None,None,None
Nestlé Heineken y PG fueron las marcas que más innovación llevaron a los supermercados en ,Nestlé,Nestlé,nsubj,OTHER
Calviño lleva al BCE y a la JUR la necesidad de minimizar la pérdida de empleo en la banca,Calviño,Calviño,nsubj,PER
El Gobierno encarecerá el recibo de la luz por la interconexión con Marruecos,El Gobierno,Gobierno,nsubj,OTHER
Las pretensiones de EEUU de una mayor regulación abren un horizonte de más bandazos en las criptomonedas,Las pretensiones de EEUU,pretensiones,nsubj,OTHER
BBVA primer banco español en sumarse a la Alianza para la Contabilidad del Carbono,BBVA,BBVA,nsubj,ORG
WhatsApp añade nuevas funciones para mejorar la comunicación entre empresas y clientes,WhatsApp,WhatsApp,nsubj,ORG
La hora del Green Recovery y la digitalización,‘Green Recovery’,None,None,None
CaixaBank se abre a rebajar más los despidos por el ERE,CaixaBank,CaixaBank,nsubj,ORG
Claves para ahorrar impuestos al cobrar el seguro de vida,Claves para ahorrar impuestos,impuestos,obj,OTHER
Así será el fondo de recapitalización para pymes y empresas medianas,fondo de recapitalización,fondo,nsubj,OTHER
Acerinox se desploma un  Nippon Steel coloca el  a  euros,Acerinox,Acerinox,nsubj,ORG
Las empresas ya trasladan a los precios la presión de las materias primas y la energía,Las empresas,empresas,nsubj,OTHER
Así es como Tous Scalpers y DFranklin pisan el acelerador digital tras el Covid,Tous,Tous,nsubj,OTHER
El lobby europeo del capital riesgo tiene nueva presidenta para afrontar un periodo clave,lobby europeo del capital riesgo,lobby,nsubj,OTHER
Openbank abarata la hipoteca fija a los clientes más diligentes,Openbank,Openbank,nsubj,ORG
Primafrio cancela su salida a Bolsa por la baja demanda,Primafrio,Primafrio,nsubj,PER
Primafrio aplaza su salida a Bolsa,Primafrio,Primafrio,nsubj,PER
Brasil calcula que recibirá  millones de dólares por la privatización de Eletrobras,Brasil,Brasil,nsubj,ORG
BBVA pide igualdad de trato para los planes de pensiones de empresa y los individuales,BBVA,BBVA,nsubj,ORG
Vivienda esperando la remontada,Vivienda,None,None,None
El Tribunal Supremo convierte en indefinidos a los interinos que lleven más de tres años en la Administración,El Tribunal Supremo ,Tribunal,nsubj,OTHER
Repsol sale al mercado para captar  millones en deuda sostenible,Repsol,Repsol,nsubj,ORG
Un plan de acción para reflotar el sector turístico,plan de acción,None,None,None
Lagarde se niega a cancelar la deuda pública para evitar problemas como los de Venezuela Argentina y Líbano,Lagarde,Lagarde,nsubj,PER
La banca puede convertirse en el sector con mayor rentabilidad por dividendo,La banca,banca,nsubj,OTHER
Alemania podría incluir a toda España en la zona de riesgo por Covid,España,España,obj,LOC
Santander Estamos atentos a oportunidades inorgánicas en EEUU,Santander,Santander,nsubj,LOC
Ayuso propone a Hacienda emular su modelo de bajos impuestos en todo el país,modelo de bajos impuestos,modelo,obj,OTHER
El BCE ligará los dividendos de la banca a los test de estrés,El BCE,BCE,nsubj,OTHER
Gay de Liébana la voz de la economía,Gay de Liébana,Gay,nsubj,LOC
El efecto Amazon fija la pauta para el salario mínimo en EEUU,efecto Amazon,efecto,nsubj,OTHER
Recuperación e inflación protagonistas de este semestre en los fondos,Recuperación,None,None,None
La firma de hipotecas alcanza niveles prepandemia y el tipo fijo gana adeptos,firma de hipotecas,firma,nsubj,OTHER
Bankinter hay vida sin Línea Directa,Bankinter,Bankinter,nsubj,ORG
Tras los descalabros del lunes el Ibex  lanza un claro mensaje de fortaleza,el Ibex ,Ibex,nsubj,OTHER
Cómo actuará el mercado en el segundo semestre,el mercado,mercado,nsubj,OTHER
Santander planta cara a los gigantes de Wall Street,Santander,Santander,nsubj,LOC
El Corte Inglés eleva un  la deuda desde febrero tras unos gastos extra de  millones,El Corte Inglés,Corte,nsubj,OTHER
Wallbox promete a sus inversores la instalación de nuevas plantas por todo el mundo,Wallbox,Wallbox,nsubj,ORG
El potencial reemplazo de Powell afectará a la renta fija y entorpecerá el tapering,reemplazo de Powell,None,None,None
La Reserva Federal estudia reducir la compra de bonos a final de año,La Reserva Federal ,Reserva,nsubj,OTHER
Goldman baja del  al  su previsión de alza del PIB de EE UU del tercer trimestre,Goldman,Goldman,nsubj,PER
Disa redujo un  su negocio petrolero por el Covid,Disa,Disa,nsubj,ORG
Esta es la parte de tu nómina que dice lo que cotizas a la Seguridad Social,parte de tu nómina,None,None,None
El IPC escala al  y elevará la factura de las pensiones en más de  millones,El IPC,IPC,nsubj,OTHER
La banca europea afronta su última oportunidad para crear un gran campeón de los pagos,banca europea,banca,nsubj,OTHER
La reforma de las pensiones sigue estando pendiente,reforma de las pensiones,reforma,nsubj,OTHER
La UE y AstraZeneca ponen fin a la batalla legal por los retrasos de entregas de vacunas,La UE,UE,nsubj,OTHER
La prosperidad común de Xi es una caja negra financiera,“prosperidad común” de Xi,prosperidad,nsubj,OTHER
Los coches eléctricos cortocircuitarán a los concesionarios,Los coches eléctricos,coches,nsubj,OTHER
Fitch Moodys y SP otorgan grado de inversión a Cepsa,Cepsa,Cepsa,obj,ORG
Frinsa proveedor de atún de Lidl o Carrefour facturó un récord de  millones en ,Frinsa,Frinsa,nsubj,ORG
El proyecto energético del Gobierno sale victorioso de su reválida en el Congreso,proyecto energético del Gobierno,proyecto,nsubj,OTHER
Google reduce beneficio en España tras elevar un  la plantilla de la filial,Google,Google,nsubj,ORG
Mirakl capta  millones para expandir el negocio de los marketplace,Mirakl,Mirakl,nsubj,ORG
Calviño aboga por retrasar la reforma fiscal hasta la recuperación,Calviño,Calviño,nsubj,PER
Los economistas ultiman rebajar del  su previsión de crecimiento para  tras la revisión a la baja del INE,Los economistas,economistas,nsubj,OTHER
Las autoridades chinas detienen al presidente y al consejero delegado de HNA,HNA,None,None,None
Alemania cinco escenarios para la Bolsa el Ibex y la prima de riesgo,Alemania,Alemania,nsubj,LOC
El regulador financiero de Suiza aprueba el primer fondo de inversión en criptoactivos,regulador financiero de Suiza,regulador,nsubj,OTHER
La voracidad de China con el carbón impulsará aún más los precios de la energía,voracidad de China,voracidad,nsubj,OTHER
Argelia garantiza a España la continuidad del suministro de gas,Argelia,Argelia,nsubj,ORG
Diez años después de la muerte de Steve Jobs Apple sigue siendo la empresa más valiosa del mundo,Apple,None,None,None
Renfe afronta mañana un nuevo día de paros parciales de los maquinistas,Renfe,Renfe,nsubj,ORG
Guindos aprecia factores estructurales en la subida de la inflación,Guindos,Guindos,nsubj,PER
La UE reduce su lista de paraísos fiscales en medio del escándalo por los Papeles de Pandora,La UE,UE,nsubj,OTHER
Más recortes para el ahorro en planes de pensiones,planes de pensiones,None,None,None
Presupuesto populista con cimientos frágiles,Presupuesto populista,None,None,None
Empieza el juicio por los  seísmos que causó la inyección de gas en Castor,Castor,None,None,None
Arrivederci Alitalia no se te echará de menos,Alitalia,None,None,None
El gurú tecnológico que saca a bolsa el primer equipo de fútbol español,El 'gurú' tecnológico,None,None,None
Bancos y turísticas frenan el repunte de pagos de dividendos en ,Bancos,Bancos,nsubj,OTHER
Lyft registró  denuncias de agresiones sexuales entre  y ,Lyft,Lyft,nsubj,PER
De Cos pide que se conserve la flexibilidad interna de las empresas aprobada por el PP,De Cos,Cos,nsubj,PER
CaixaBank pierde cuota en empresas por la fusión ganan Bankinter y Sabadell,CaixaBank,CaixaBank,nsubj,ORG
Los grandes valores más baratos de Europa incluyen a Banco Santander y BBVA,valores más baratos,valores,nsubj,OTHER
Los grandes valores más baratos de Europa incluyen a Banco Santander y BBVA,Banco Santander,Banco,obj,ORG
Las Big Tech crecen un  con el impulso de Microsoft y Google,Las 'Big Tech',Big,nsubj,OTHER
Squid así colapsó la criptomoneda del Juego del calamar,Squid,Squid,nsubj,ORG
Facebook sabe que es nocivo para  millones de usuarios el  del total,Facebook,Facebook,nsubj,ORG
Biden no cree que la OPEP vaya a ayudar con los precios del petróleo,la OPEP+,OPEP,nsubj,OTHER
Sabadell coloca  millones de euros en cocos al ,Sabadell,Sabadell,nsubj,LOC
El misterio de quién inventó el bitcóin llega a juicio,el bitcóin,bitcóin,obj,OTHER
Igualada reinventa su industria de la moda tricot para el fast fashion y piel para el lujo,Igualada,Igualada,nsubj,LOC
La UE advierte de las consecuencias económicas que tendrá no encontrar solución a la crisis de los refugiados,UE,UE,nsubj,ORG
La deuda de las familias cae en  millones en  y marca niveles previos a la crisis,deuda de las familias,deuda,nsubj,OTHER
TAG Heuer se sube a los esquís,TAG Heuer,TAG,nsubj,MISC
La Caixa invierte  millones en un proyecto urbanístico en Andorra,La Cixa,None,None,None
Glencore vende un  de su negocio agrícola a un fondo canadiense,Glencore,Glencore,nsubj,ORG
Worktel la opción para montar su oficina en un hotel,Worktel,None,None,None
Pikolin único finalista español al premio a la Excelencia Logística,Pikolin,Pikolin,nsubj,PER
Las ventas de vehículos de ocasión cae un  en el primer trimestre del año,ventas de vehículos de ocasión,ventas,nsubj,OTHER
Fondos cotizados para cada perfil inversor,Fondos cotizados,None,None,None
La incubadora del CEEIARAGON acoge tres nuevas empresas,CEEIARAGON,None,None,None
El agua elemento imprescindible para el desarrollo económico,El agua,None,None,None
Grup Peralada compra el edificio de Versace en el Passeig de Gràcia,Grup Peralada,Grup,nsubj,ORG
El BCE invierte  millones en sus primeras compras de bonos de empresas,El BCE,BCE,nsubj,OTHER
Los hogares aragoneses podrían ahorrar  millones al año en la factura energética,hogares aragoneses,hogares,nsubj,OTHER
Renault Pasion Tour un evento pensado para toda la familia,Renault Pasion Tour,Renault,nsubj,MISC
Bestinver no hay momento más inoportuno para el Brexit,Bestinver,Bestinver,nsubj,ORG
La AIReF asegura que el PIB creció un  en el segundo trimestre y repuntará un  en el tercero,el PIB,PIB,nsubj,OTHER
El sector servicios crece al ritmo más rápido desde noviembre,sector servicios,sector,nsubj,OTHER
Ortiz devuelve  millones a Ikea y reclama  millones a Alicante y el Consell por errores,Ortiz,Ortiz,nsubj,PER
Draghi protesta por el registro policial efectuado en el banco central de Eslovenia,Draghi,Draghi,nsubj,PER
Los nuevos ERTE mantienen la prohibición de despedir y eliminan las ventajas sociales a las empresas que no formen,Los ‘nuevos’ ERTE,ERTE,nsubj,OTHER
Las CCAA y los sindicatos exigen seguridad jurídica en la reforma para los interinos,Las CCAA,CCAA,nsubj,OTHER
Santander ganó  millones de euros un  menos y supera previsiones,Santander,Santander,nsubj,LOC
Volkswagen introducirá el filtro de partículas en los motores de gasolina a partir de ,Volkswagen,Volkswagen,nsubj,ORG
Dogi convoca junta extraordinaria para ratificar la compra de Treiss,Dogi,Dogi,nsubj,PER
Las unit economics como base del modelo de negocio,unit economics,None,None,None
Qué es el Registro Mercantil,el Registro Mercantil,None,None,None
Hugo Boss advierte de que no cumplirá previsiones por el descenso de ventas en China,Hugo Boss,Hugo,nsubj,PER
Avinatur sitúa su planta de Granada a la cabeza del sector,Avinatur,Avinatur,nsubj,ORG
Pérez Baquero abrirá un hotel de  estrellas junto a Plaça Catalunya,Pérez Baquero,Pérez,nsubj,PER
La inflación de la eurozona se mantiene en el  en agosto,inflación de la eurozona,inflación,nsubj,OTHER
Rodilla crea un servicio de catering para empresas,Rodilla,Rodilla,nsubj,PER
ING recrudece la batalla hipotecaria al rebajar sus hipotecas fija y mixta,ING,ING,nsubj,ORG
Nike HyperAdapt  las zapatillas que se atan solas,Nike HyperAdapt .,Nike,nsubj,OTHER
La apuesta de la NFL por la globalización,la NFL,None,None,None
Banco Sabadell supera las previsiones y eleva su beneficio un  hasta septiembre,Banco Sabadell,Banco,nsubj,ORG
Vemedia Queremos hacer compras en España,Vemedia,Vemedia,nsubj,OTHER
El número de desempleados aumenta en  personas en octubre,número de desempleados,número,nsubj,OTHER
En libertad con cargos cuatro de los detenidos de la organización UPA Extremadura,detenidos de la organización UPA,None,None,None
Las coberturas menos conocidas de los seguros de coche,coberturas ,None,None,None
Así afecta la política de Trump a diez empresas,política de Trump,política,nsubj,OTHER
El AVE llegará a Murcia a finales de ,El AVE,AVE,nsubj,OTHER
El nuevo escenario de tipos riega de pérdidas los bonos de Telefónica Abertis e Iberdrola,nuevo escenario de tipos,escenario,nsubj,OTHER
AQR desembarca en BBVA y ya es el mayor azote bajista de la banca,AQR,AQR,nsubj,ORG
Destinia cierra el Black Friday con una subida del  en su facturación,Destinia,Destinia,nsubj,ORG
Segway lanza Ninebot Mini su último y divertidísimo monopatín eléctrico,Ninebot Mini,Ninebot,obj,MISC
El grifo de cerveza se vuelve digital,grifo de cerveza,grifo,nsubj,OTHER
China estrena mañana la conexión entre las bolsas de Hong Kong y Shenzhen,China,China,nsubj,ORG
Gibraltar pide un acuerdo diferenciado con la UE tras el Brexit,Gibraltar,Gibraltar,nsubj,ORG
Barcelona premiará con tres años de transporte público gratuito a los que se deshagan de sus coches contaminantes,Barcelona,Barcelona,nsubj,LOC
El verano creó  empleos más en los mayores destinos,El verano,None,None,None
La Societat Econòmica dAmics del País pide diálogo y rechaza la desobediencia,La Societat Econòmica d'Amics,Societat,nsubj,OTHER
El Sorteo de Navidad deja  millones en la provincia de Badajoz,Sorteo de Navidad,Sorteo,nsubj,MISC
Fondo de Garantía Inversiones en Degiro Broker Online,Fondo de Garantía Inversiones,None,None,None
Grocasa Hipotecas consolida su crecimiento en ,Grocasa Hipotecas,Grocasa,nsubj,MISC
Saracho deja JP Morgan para fichar como presidente de Popular,Saracho,Saracho,nsubj,PER
Las empresas han dado un salto de competitividad,Las empresas,empresas,nsubj,OTHER
La sombra de Donald Trump se cierne sobre la economía mexicana,sombra de Donald Trump,sombra,nsubj,OTHER
Abe pide cifras de inversión en EEUU para Trump,Abe,Abe,nsubj,PER
Gaia apuesta por alianzas centros de innovación y oferta especializada,Gaia,Gaia,nsubj,ORG
Una sentencia avala que se pueda despedir a un miembro del comité de empresa,miembro del comité de empresa,miembro,obj,OTHER
Un vicepresidente de Santander presidirá Lloyds of London,vicepresidente de Santander,vicepresidente,nsubj,OTHER
La oposición obliga a retirar los expedientes de modificación de crédito para pagar los ICO,La oposición,oposición,nsubj,OTHER
Grecia pide  millones al Banco Mundial para crear  empleos,Grecia,Grecia,nsubj,ORG
Los trabajadores de Nueva Pescanova irán a la huelga el  y el  de marzo,trabajadores de Nueva Pescanov,trabajadores,nsubj,OTHER
China lidera una nueva energía nuclear limpia y barata basada en el torio,China,China,nsubj,ORG
El Chart de Hódar Liberbank a la cabeza del sector,Liberbank,None,None,None
Moneycorp crece en España con las miras puestas en América Latina,Moneycorp,Moneycorp,nsubj,ORG
Wall Street vuelve a tirar del carro,Wall Street,Wall,nsubj,LOC
GR de BMW o cómo una marca premium apuesta por el low cost,BMW,None,None,None
Vara se siente engañado con la inversión de los Presupuestos en Extremadura,Vara,Vara,nsubj,PER
Algora inicia una campaña para que el nuevo Seat lleve su nombre,Algora,Algora,nsubj,PER
El PIB francés crece un  en el primer trimestre,El PIB francés,PIB,nsubj,OTHER
Aragón Plataforma Logística estrena web con un buscador único de parcelas,Aragón Plataforma Logística,Aragón,nsubj,ORG
Empark se adjudica su primer contrato en Francia,Empark,Empark,nsubj,ORG
Repsol somete este viernes a su junta de accionistas el pago de un dividendo complementario de  euros,Repsol,Repsol,nsubj,ORG
Más cambios en LOccitane la compañía nombra nuevo consejero delegado,L'Occitane,None,None,None
Un documental chino muestra que hay vida después de la quiebra de una empresa,documental chino,documental,nsubj,OTHER
Apple añade a su familia de tabletas un iPad Pro de  pulgadas,Apple,Apple,nsubj,ORG
El FMI insta a China a acelerar las reformas para consolidar su crecimiento,El FMI,FMI,nsubj,OTHER
Primark abre la tienda más grande de Cataluña en Tarragona,Primark,Primark,nsubj,ORG
España el país más barato de la eurozona para comprar ropa,España,España,nsubj,LOC
Vinissimus de la bodega a la Red,Vinissimus,None,None,None
Los áticos y dúplex de obra nueva más lujosos del centro de Madrid,Los áticos y dúplex,None,None,None
IBM presenta un procesador cuántico cuya capacidad de cálculo es imposible de simular con un ordenador clásico,IBM,IBM,nsubj,ORG
Diez planes de pensiones con rentabilidades superiores al ,planes de pensiones,None,None,None
Las islas lideran la subida de precios en el primer semestre,Las islas,islas,nsubj,OTHER
Leopoldo del Nogal abandona el consejo de administración de El Corte Inglés,Leopoldo del Nogal,Leopoldo,nsubj,PER
Boeing sube en bolsa después de volver a la senda de los beneficios tras dos años,Boeing,Boeing,nsubj,ORG
Regal Lion el tapón joya para vinos y licores que cuesta  euros,Regal Lion,Regal,nsubj,PER
Ericsson podría recortar hasta  empleos fuera de Suecia,Ericsson,Ericsson,nsubj,ORG
