Heading,Target,pred_target,dependencia,pred_entidad
Sacyr repartirá un dividendo flexible de  euros o una acción por cada  antiguas,Sacyr,Sacyr,nsubj,ORG
Cotización de Bradespar N,Cotización de Bradespar,None,None,None
APORTAR VALOR A LA HOSTELERÍA,LA HOSTELERÍA,HOSTELERÍA,obj,OTHER
El fintech mexicano Klar levanta M en una ronda Serie A liderada por IFC y Prosus Ventures,fintech mexicano Klar,fintech,nsubj,OTHER
AMLO ordena investigación por corrupción en PF revela compra a sobreprecio,AMLO,AMLO,nsubj,ORG
Selfridges entra en pérdidas en  antes de cambiar de manos,Selfridges,Selfridges,nsubj,PER
Los seis valores del Ibex que ya han recibido este año potenciales superiores al ,Ibex,None,None,None
La producción industrial regresa a tasas positivas tras subir un  en noviembre,producción industrial,producción,nsubj,OTHER
Si el mercado de bolsas de todo el mundo se vuelve bajista estas son las medias en descenso históricas,mercado de bolsas,mercado,nsubj,OTHER
Bruselas insiste en reivindicar la tasa Google,Bruselas,Bruselas,nsubj,ORG
Deutsche Telekom prueba una nueva oficina virtual con el software Sococo de Aurea,Deutsche Telekom,Deutsche,nsubj,ORG
Kostarof Repsol OHL BBVA Caixabank ASML Holding Palantir,Kostarof,None,None,None
CaixaBank busca los mejores proyectos de autoempleo creados por mujeres,CaixaBank,CaixaBank,nsubj,ORG
La nueva promesa de Volkswagen para finales de  es una declaración de guerra a Tesla,Volkswagen,None,None,None
La banca española se mantiene a la cola de la eurozona en capital,La banca española,banca,nsubj,OTHER
El petróleo avista los  dólares la demanda gana a la normalidad en Kazajistán y Libia,El petróleo,petróleo,nsubj,OTHER
Apertura alcista a la espera de PMIs finales Energías Renovables,Apertura alcista,None,None,None
Mirabaud duplica su plantilla de banca de inversión,Mirabaud,Mirabaud,nsubj,ORG
El activismo climático veta al gas,gas,gas,obj,OTHER
Ampliaciones de Capital,Ampliaciones de Capital,None,None,None
El fabricante taiwanés de microchips TSMC ganó el récord de  millones un  más,fabricante taiwanés de microchips,fabricante,nsubj,OTHER
Así es el programa de avales para pymes de CERSA,CERSA,None,None,None
La subida está encabezada por el sector servicios al que pertenecen dos de cada tres contratos temporales firmados en ,sector servicios,sector,obj,OTHER
Arrendamiento y seguridad dos conceptos que deberían ir de la mano para las compañías,Arrendamiento,None,None,None
Según reflejan los datos provisionales del Banco de España la morosidad de la banca de los préstamos concedidos por el total de entidades de crédito a empresas y particulares cayó en septiembre al  frente al  de agosto,morosidad de la banca,morosidad,nsubj,OTHER
La vivienda nueva y usada subió un  en diciembre de ,vivienda nueva y usada,vivienda,nsubj,OTHER
Singerfy recibe una inversión de  por parte de diversos business angels,Singerfy,Singerfy,nsubj,ORG
Cotización de Nokia,Nokia,None,None,None
A lo largo del ejercicio del año  la deuda de la banca española se ha incrementado en  millones de euros un  más,deuda de la banca española,deuda,nsubj,OTHER
Bershka los ocho chollos al  que no puedes desaprovechar,Bershka,Bershka,nsubj,PER
Telepizza se convierte en patrocinador oficial de LaLiga,Telepizza,Telepizza,nsubj,ORG
Pemex no necesita perforar pozo para evaluar el megayacimiento Zama Talos Energy,Pemex,Pemex,nsubj,ORG
Productos de alimentación de El Corte Inglés que están al ,El Corte Inglés,None,None,None
Las  leyes del liderazgo de John Maxwell I,John Maxwell,None,None,None
Iberia Express lanza una nueva tarifa classic plus para adaptarse a las nuevas necesidades de los clientes,Iberia Express,Iberia,nsubj,ORG
El PIB de China creció un  en  el mayor ritmo de crecimiento desde ,El PIB de China,PIB,nsubj,OTHER
Oral B Braun y más  productos de higiene y belleza con rebajas increíbles en Amazon,Oral B,None,None,None
PLATAFORMA DENARIA,PLATAFORMA DENARIA,None,None,None
Globalia mete miedo a sus rivales en el segmento de viajes para empresas,Globalia,Globalia,nsubj,ORG
Stadler logra el mayor contrato de su historia de  millones con un modelo creado en España,Stadler,Stadler,nsubj,PER
Igea Los problemas del campo no se solucionan trayendo señoritos de Madrid con castellanos a hacerse unas fotos,problemas del campo,problemas,nsubj,OTHER
Videoescándalo toca a familia de AMLO captan a su hermano y a David León en entrega de dinero,familia de AMLO,None,None,None
El retraso en el dique de las fragatas dividió al consejo de Navantia,retraso en el dique de las fragatas,retraso,nsubj,OTHER
La Xunta apuesta por una fábrica de microchips en Galicia para acabar con la crisis de PSA,La Xunta,Xunta,nsubj,OTHER
De Buenos Aires a Madrid abre la librería La Mistral,librería La Mistral,librería,obj,OTHER
Repsol a un paso de duplicar su precio desde enero de ,Repsol,None,None,None
España registra  nuevas empresas mercantiles y vuelve a tasas positivas mientras que las disoluciones empresariales crecen un  interanual,España,España,nsubj,LOC
EURUSD es probable un nuevo máximo antes de cualquier corrección importante,EURUSD,EURUSD,nsubj,ORG
Dos mercados españoles que ningún gourmet debería perderse,Dos mercados españoles,None,None,None
Comunicación integral de marketing en la era digital retos y desafíos en tiempos de pandemia,Comunicación integral de marketing,Comunicación,nsubj,OTHER
Gisela Sánchez es reconocida como la primera latinoamericana Intraemprendedora Social Corporativa,Gisela Sánchez,Gisela,nsubj,PER
El incremento se eleva un  respecto al mismo periodo del ejercicio anterior,El incremento,incremento,nsubj,OTHER
Nubes de puntos y BIM por BIM ZONE,BIM,None,None,None
Inditex podría ganar más de un  en bolsa este año según Goldman Sachs,Inditex,Inditex,nsubj,ORG
Videojuegos importante sector para el marketing y la creatividad,Videojuegos,Videojuegos,nsubj,OTHER
La Comisión Europea aprueba las ayudas de  millones para el transporte inteligente,La Comisión Europea,Comisión,nsubj,OTHER
Dazn lanza Dazn studios como parte de su estrategia global de contenido original para ,Dazn,Dazn,nsubj,PER
El Gobierno estudiará incentivos para funcionarios que quieran trabajar más allá de los ,incentivos para funcionarios,incentivos,obj,OTHER
Cómo conseguir tu objetivo en trading,objetivo en trading,objetivo,obj,OTHER
El arte emergente y digital llega a la Costa Brava,arte emergente y digital,arte,nsubj,OTHER
SEC Reclamos por electricidad y gas bajaron casi  luego de un  marcado por la facturación provisoria,Reclamos ,None,None,None
Bitdefender detecta un virus que roba monederos de criptomonedas,Bitdefender,Bitdefender,nsubj,ORG
La tasa de hash del bitcoin se acerca a máximos históricos pero el precio sigue cayendo qué debes saber sobre el trading de bitcoin en  y  tokens alternativos a vigilar,bitcoin,None,None,None
Estos son los productos que la DGT recomienda tener en el coche durante el invierno,productos que la DGT recomienda,DGT,nsubj,OTHER
El fenómeno de las ballenas en las criptomonedas,ballenas en las criptomonedas,None,None,None
Conociendo las criptomonedas,las criptomonedas,criptomonedas,obj,OTHER
Todas las pensiones suben en  esta es la cuantía que vas a recibir a partir de enero,Todas las pensiones,pensiones,nsubj,OTHER
AMLO descarta apagón en Nuevo León si termina contrato de Iberdrola,AMLO,AMLO,nsubj,ORG
Itaú Unibanco aumentaría control del banco en Chile tras comprar opciones de acciones del grupo Saieh,Itaú Unibanco,Itaú,nsubj,ORG
Zara  bolsos chulos en rebajas que puedes comprar por  euros,Zara,None,None,None
Agenda La Comisión presenta su propuesta para los trabajadores de plataformas,La Comisión,Comisión,nsubj,OTHER
La Comisión aprueba el mayor presupuesto para el apoyo a las alianzas entre universidades europeas,La Comisión,Comisión,nsubj,OTHER
Innovar para crecer las mejores estrategias al alcance de las Pymes,Pymes,None,None,None
Cierre de mercados,mercados,None,None,None
La reforma de Montero limitará la capacidad fiscal de las comunidades en los impuestos cedidos,reforma de Montero,reforma,nsubj,OTHER
Bankinter gana  millones en  gracias a la salida a bolsa de Línea Directa,Bankinter,Bankinter,nsubj,ORG
La funda compatible con iPad de Apple número  en ventas en Amazon  colores distintos,funda compatible con iPad,None,None,None
Boom verde  de cada  dólares de las entradas de capital mundial se destinan a ASG,Boom ‘verde’,Boom,nsubj,OTHER
Värde e inversores internacionales inyectarán  millones en WiZink,Värde,Värde,nsubj,PER
Unicaja reacciona ante un manifiesto de exdirectivos contra Braulio Medel,Unicaja,Unicaja,nsubj,ORG
La confianza empresarial cae un  por las peores expectativas ante ómicron,La confianza empresarial,confianza,nsubj,OTHER
 grandes retos a los que se enfrenta el CEO de Disney Bob Chapek tras la marcha de Bob Iger,CEO de Disney,CEO,nsubj,OTHER
Los datos sobre el uso de los ascensores arrojan una caída del  en la afluencia a la oficina por ómicron,uso de los ascensores,None,None,None
Nuevo mazazo para el consumidor suben las comisiones por descubierto de las entidades bancarias a pesar de haber sido declaradas como abusivas,comisiones por descubierto,comisiones,nsubj,OTHER
Una nueva estafa relacionada con Bizum puede hacerte perder mucho dinero,Bizum,Bizum,obj,ORG
Iberdrola Seat y Volkswagen llegan a un acuerdo para promover el coche eléctrico en España instalarán  puntos de carga en espacios públicos y privados,Iberdrola,Iberdrola,nsubj,OTHER
 grandes empresas y  ONG que permiten pagar con bitcoin y otras criptomonedas, grandes empresas,None,None,None
Primark crece en Europa del Este y desembarca en Rumanía,Primark,Primark,nsubj,ORG
El Ibex  no alcanza los  puntos con la vista en las actas del BCE,El Ibex ,Ibex,nsubj,OTHER
Dia logra ventas de  millones en  un  menos,Dia,Dia,nsubj,OTHER
Cuenta regresiva para proyecto de Enjoy en Pucón sigue sin tener la autorización del regulador y se acorta el tiempo para entregar las obras,proyecto de Enjoy,None,None,None
El mayor error que puede cometer un emprendedor ahora mismo según el cofundador de Lets Bonus y Wallapop,un emprendedor,emprendedor,nsubj,OTHER
El empeño de Google en volver a las oficinas en septiembre está frustrando a algunos empleados que dicen que renunciarán si no pueden trabajar a distancia de manera permanente,Google,None,None,None
Un directivo de la división de inteligencia artificial de Amazon comparte los  pasos que ha tomado la compañía para convertirse en un referente tecnológico del sector,Amazon,None,None,None
La cadena de supermercados valenciana vende  unidades al día de este producto,cadena de supermercados valenciana,cadena,nsubj,OTHER
El anteproyecto de Ley de Startups es una buena noticia pero la definición de startup se queda corta y las medidas son insuficientes según varios agentes del ecosistema emprendedor,anteproyecto de Ley de Startups,anteproyecto,nsubj,OTHER
Los  mejores juegos de Xbox Game Pass,Xbox Game Pass,None,None,None
Orlando dona más de  raciones de tomate a Cáritas y Carifood como parte de su programa Orlando cocina y camina,Orlando,Orlando,nsubj,PER
El coronavirus ha supuesto un espaldarazo definitivo para el teletrabajo apenas un  de los españoles trabajaba desde casa en  frente al  que asegura hacerlo en la actualidad,teletrabajo,None,None,None
Este plan de  pasos te ayudará a conseguir el aumento de sueldo que mereces,plan de  pasos,plan,nsubj,OTHER
Arcano abre oficina en Bilbao para crecer en la industria,Arcano,Arcano,nsubj,PER
Una de las action cam más potentes del mercado la GoPro Hero Black ha recibido un descuento del ,la GoPro Hero Black,None,None,None
 puntos rápidos en logística si vas a emprender en comercio electrónico,puntos rápidos en logística,None,None,None
Los grandes emprendedores también fracasaron,grandes emprendedores,emprendedores,nsubj,OTHER
Amazon tiene un cálculo anual del número de trabajadores que no le importaría perder y para sus empleados es una de las razones por las que su cultura empresarial es despiadada,Amazon,Amazon,nsubj,ORG
Las carteras de Finizens llegaron a ofrecer en  una rentabilidad de hasta el ,Las carteras de Finizens,carteras,nsubj,OTHER
Las urbes causan el  de las emisiones contaminantes y  megaciudades son culpables de más de la mitad,Las urbes,urbes,nsubj,OTHER
El Ibex  sube un  y otras  claves de la Bolsa en ,El Ibex ,Ibex,nsubj,OTHER
La sombra de Bankia llega hasta Ibercaja los minoristas vuelven a quedarse fuera,Bankia,None,None,None
El Gobierno de EEUU investiga  accidentes supuestamente provocados por el piloto automático de Tesla,piloto automático de Tesla,piloto,obj,OTHER
España ya cuenta con  unicornios y con  compañías que podrían serlo en los próximos dos años,España,España,nsubj,LOC
Guía para ser una pyme sostenible que responda a las exigencias ambientales de sus clientes,pyme sostenible,None,None,None
Amazon también te lleva a viajar al espacio,Amazon,Amazon,nsubj,ORG
Corregir un billete de avión es más caro que comprar otro pasaje,Corregir un billete de avión,billete,obj,OTHER
El Xiaomi Mi i es perfecto para los que huyan de las curvas en pantalla y busquen rendimiento en un gama alta muy solvente,El Xiaomi Mi i,Xiaomi,nsubj,OTHER
El Volvo XC cuida de ti como tú cuidas de los demás así son las innovaciones en seguridad de Volvo explicadas en este video,El Volvo XC,Volvo,nsubj,OTHER
El Xiaomi Redmi Note  tiene una cámara más modesta que su versión Pro pero con una batería duradera carga rápida perfecto para gaming y excelente relación calidadprecio,Xiaomi Redmi Note ,Xiaomi,nsubj,OTHER
 cosas que es mejor que compres de segunda mano y te harán ahorrar cientos de euros,segunda mano,None,None,None
La restauración es un sector muy poco actualizado tecnológicamente,La restauración,restauración,nsubj,OTHER
Así se invierten los fondos del sistema nacional de pensiones mercado extranjero toma fuerza,mercado extranjero,None,None,None
Mercadotecnia  Alcanzar la velocidad del cambio,Mercadotecnia ,Mercadotecnia,nsubj,OTHER
La deuda pública española crece en el último año más de un ,deuda pública española,deuda,nsubj,OTHER
El lado más absurdo del turismo de masas llega al teatro Lliure,turismo de masas,None,None,None
Entra en vigor la ley de transformación digital del sistema financiero cómo afectará a la economía española,ley de transformación digital,ley,nsubj,OTHER
Georgieva FMI advierte de que las subidas de tipos en EEUU pueden enfriar la recuperación de algunos países,Georgieva (FMI),Georgieva,nsubj,OTHER
La castellonense Valfortec invertirá  millones en un planta entre Elda y Novelda,La castellonense Valfortec,castellonense,nsubj,OTHER
La negociación del salario mínimo se retrasa por la falta de apoyos para la reforma laboral,negociación del salario mínimo,negociación,nsubj,OTHER
Encontrar un abogado de familia especializado de manera inmediata es posible gracias a LexGoApp,LexGoApp,None,None,None
Los bonos en dólares cayeron y el riesgo país se disparó por encima de  puntos,bonos dólares,bonos,nsubj,OTHER
El regulador británico difunde respuestas de las partes a la compra de Hutchinson por Cellnex,El regulador británico,regulador,nsubj,OTHER
El FMI prevé una carrera de obstáculos en la recuperación en ,El FMI,FMI,nsubj,OTHER
La otra cara del hundimiento del petróleo las navieras convierten sus megabuques en almacenes flotantes alquilados a precios de oro a grandes energéticas,hundimiento del petróleo,None,None,None
El Tamagotchi regresa por todo lo alto pantalla a color cámara y mucho más,El Tamagotchi,Tamagotchi,nsubj,OTHER
El despliegue del G es una oportunidad de oro para que Europa se iguale a EEUU y China en la carrera tecnológica según la exministra Pilar del Castillo,despliegue del G,despliegue,nsubj,OTHER
Un joven gamer de  años gana  millones de euros en  revendiendo en tiempos de pandemia PS Xbox Series XS y otros productos de lujo,Un joven 'gamer',gamer,nsubj,OTHER
Una directiva con burbujas en la sangre,Una directiva,None,None,None
IBM retira su negocio de reconocimiento facial y su CEO pide un diálogo nacional sobre el encaje legal y el uso de esta tecnología,IBM,IBM,nsubj,ORG
Se abren oportunidades de trabajo en Austria cuánto pagan y cómo aplicar desde Argentina,oportunidades de trabajo en Austria,oportunidades,nsubj,OTHER
El Corte Inglés está buscando trabajadores para su campaña de Navidad así puedes apuntarte a las ofertas,El Corte Inglés,Corte,nsubj,OTHER
El AWACS El súper radar capaz de controlar una batalla aérea,El AWACS,AWACS,nsubj,OTHER
Los Xiaomi Mi  Ultra y Mi i llegan a España para batirse en duelo con lo mejor del mercado buena cámara diseño y procesador,Xiaomi Mi  Ultra,Xiaomi,nsubj,MISC
Samsung tiene unos auriculares inalámbricos llamados Galaxy Buds de  euros para competir con los AirPods de Apple estas son las principales diferencias,Samsung,Samsung,nsubj,ORG
Google ha empezado silenciosamente a escanear todas tus fotos para identificar textos pero podría estar incumpliendo el GDPR al no haberte pedido permiso primero,Google,Google,nsubj,ORG
Slack se dispara casi un  en su estreno en Bolsa en Wall Street empieza a cotizar a  dólares la acción,Slack,Slack,nsubj,PER
La tarifa móvil como sustituto de la linea de internet fijo en casa,La tarifa del móvil,None,None,None
El Gobierno confirma que analizará cobrar el impuesto a la herencia en ,El Gobierno,Gobierno,nsubj,OTHER
Así evolucionaron las fortunas de los más ricos de entre los ricos en ,fortunas de los más ricos,fortunas,nsubj,OTHER
EEUU alza la voz contra la reforma eléctrica de México que también afecta a la española Iberdrola,EE.UU.,None,None,None
Estas  gráficas muestran cómo ha evolucionado el empleo femenino durante las  últimas crisis pocos cambios entre  y  y en paralelo a la ocupación masculina durante la pandemia,empleo femenino,empleo,nsubj,OTHER
Gigas pide aprovechar el programa Kit Digital para reforzar el ecosistema tecnológico nacional,programa 'Kit Digital',programa,obj,OTHER
Commerzbank y su posible fusión,Commerzbank,None,None,None
Un informe marca el camino para cambiar el curso del cambio climático  años y  billones de inversión para reducir drásticamente las emisiones crear  millones de empleos y aumentar el PIB mundial,curso del cambio climático,curso,obj,OTHER
Elon Musk se burla de Jeff Bezos,Elon Musk,Elon,nsubj,PER
Sodercan aprueba ayudas para nueve proyectos de ID de economía circular,Sodercan,Sodercan,nsubj,ORG
El dólar frena ganancias a la espera de la decisión de la Fed,El dólar,dólar,nsubj,OTHER
El PSOE advierte de que oponerse a la reforma laboral perjudica al diálogo social,la reforma laboral,reforma,obj,OTHER
Consultorio de Fondos con José María Luna Luna y Sevilla Asesores Patrimoniales,Consultorio de Fondos,None,None,None
El número de inversores en la Bolsa española cae un  en ,inversores en la Bolsa española,None,None,None
Eurofinsa se adjudica su segundo contrato de obras en Paraguay por  millones de dólares,Eurofinsa,Eurofinsa,nsubj,ORG
Este smartwatch te dice cuánta energía te queda para que controles tu estrés y está ahora mismo rebajado más de  euros en Amazon,smartwatch,smartwatch,nsubj,OTHER
Dólar futuro intervención oficial cayó hasta niveles que no se veían desde antes de la crisis del COVID,intervención oficial,intervención,nsubj,OTHER
Lo que debes saber este miércoles antes de que abra el mercado Podcast,mercado,mercado,obj,OTHER
El precio de la luz baja ligeramente y la gasolina está disparada estas son las franjas horarias más baratas,precio de la luz,precio,nsubj,OTHER
 errores que tienes que evitar al alquilar una oficina, errores,None,None,None
Cómo van a cambiar los contratos de alquiler con la derogación del decreto de vivienda,contratos de alquiler,contratos,obj,OTHER
Amazon acaba de lanzarse al negocio del renting en España así puedes alquilar un Tesla o un BMW desde su web,Amazon,Amazon,nsubj,ORG
Así es el coche autónomo del ejército español,coche autónomo,coche,nsubj,OTHER
WhatsApp identificará los mensajes reenviados para combatir la desinformación,WhatsApp,WhatsApp,nsubj,ORG
Tendencias on demand Calidad local con proyección global,calidad local,None,None,None
Toushka celebra la º edición del Foro de Inversión en Venture Capital,Toushka,Toushka,nsubj,PER
El mercado del cannabis por edades,mercado del cannabi,None,None,None
Biotecnología es el referente para el desarrollo de nuevos clústeres,Biotecnología,Biotecnología,nsubj,MISC
La Ruta Xacobea de AC bate un récord,La Ruta Xacobea de A,Ruta,nsubj,OTHER
Las economías avanzadas frenan su recuperación la OCDE avanza que el crecimiento ha tocado techo y se ralentizará en los próximos meses,Las economías avanzadas,economías,nsubj,OTHER
Ley Rider más subidas al salario mínimo o regular los precios del alquiler los deberes del Gobierno para  que la pandemia metió en un cajón,deberes del Gobierno,deberes,obj,OTHER
Soy ALT es la radio que nos gustaría escuchar,Soy ALT ,ALT,nsubj,OTHER
Vodafone,Vodafone,None,None,None
Barcelona acogerá las primeras pruebas de la nueva Fórmula ,Barcelona,Barcelona,nsubj,LOC
Con sus  caballos de fuerza llegó el Bugatti Chiron,el Bugatti Chiron,Bugatti,nsubj,OTHER
La luz superará este jueves los  euros MWh y marcará récord histórico,La luz,luz,nsubj,OTHER
Revelan que el Club de París le hizo un pedido especial al Gobierno para que acuerde con el FMI,Club de París,Club,nsubj,ORG
Majorel desembarca en Macedonia del Norte y Ghana,Majorel,Majorel,nsubj,PER
Cómo comprar NFTs ventajas y desventajas de inversión,NFT’s,None,None,None
Vacíos legales en la lucha contra la corrupción y la inseguridad,Vacíos legales,None,None,None
Banc Sabadell gana  millones en  TSB ya aporta el  del beneficio,Banc Sabadell,Banc,nsubj,ORG
La Primera de Expansión sobre Aena El Corte Inglés Nomura y la decisión de la Fed de subir tipos en marzo,La Primera de Expansión,None,None,None
Hochtief ACS construirá un túnel en Gales por  millones para transportar electricidad,Hochtief (ACS),Hochtief,nsubj,OTHER
La revista ejecutivos ha celebrado la III edición de los premios ejecutivos Cantabria,La revista ejecutivos,revista,nsubj,OTHER
La supremacía estadounidense en Inteligencia Artificial amenazada por China,La supremacía estadounidense,None,None,None
El sofisticado y elegante bolso de Desigual que está rebajado un ,bolso de Desigual,None,None,None
Suecia aprueba plan para enterrar durante  años el combustible nuclear,Suecia,Suecia,nsubj,LOC
Ferrovial construirá un tramo del gaseoducto que conecta Noruega Dinamarca y Polonia por  millones,Ferrovial,Ferrovial,nsubj,ORG
CaixaBank gana  millones por el efecto contable de absorber Bankia,CaixaBank,CaixaBank,nsubj,ORG
Bolsas en rojo tras el efecto coronavirus y los malos datos macro,Bolsas en rojo,None,None,None
inbestMe vuelve a bajar sus comisiones,inbestMe,inbestMe,nsubj,OTHER
Banco Sabadell cocina un incremento del dividendo,Banco Sabadell,Banco,nsubj,ORG
El programa Horizonte Europa centrado en los ecosistemas la biodiversidad y la economía circular,programa Horizonte Europa,programa,nsubj,OTHER
Fempa facilita el acceso a la profesión de conservador de ascensores,Fempa,Fempa,nsubj,ORG
Carrefour pone en marcha una iniciativa social para adquirir vehículos adaptados a favor de menores con discapacidad,Carrefour,Carrefour,nsubj,ORG
El Banco de Inglaterra mantiene tipos y espera que la inflación llegue al  en el cuarto trimestre,Banco de Inglaterra,Banco,nsubj,ORG
Latam prevé operar a  de capacidad en enero pero condicionado al avance de ómicron,Latam,Latam,nsubj,ORG
El Supremo ratifica la validez de las hipotecas IRPH tras las últimas resoluciones del Tribunal de la UE,El Supremo,Supremo,nsubj,OTHER
Los cuatro directivos de Repsol investigados por el vertido no podrán salir de Perú durante  meses,directivos de Repsol,directivos,nsubj,OTHER
De Megasa a Coren las mujeres toman las riendas en la empresa gallega,las mujeres,mujeres,nsubj,OTHER
BANCOS,BANCOS,None,None,None
Renfe y Adif se preparan para una nueva jornada de paros parciales,Renfe,Renfe,nsubj,ORG
Este gráfico muestra por qué los problemas de la banca van más allá del COVID,problemas de la banca,problemas,nsubj,OTHER
Ikea declara la guerra al desperdicio de alimentos en sus restaurantes españoles,Ikea,Ikea,nsubj,ORG
La Generalitat Valenciana presentará este lunes las alegaciones a la propuesta de financiación,La Generalitat Valenciana,Generalitat,nsubj,OTHER
La CEPAL estima que la economía argentina caerá un  en ,la economía argentina,economía,nsubj,OTHER
Por la pandemia Argentina está en el podio de aumento de la desigualdad en la región indicó la Cepal,Argentina,Argentina,nsubj,ORG
Por la senda de la sostenibilidad que traza el Pacto Mundial,el Pacto Mundial,Pacto,nsubj,OTHER
La nueva colección de maquillaje de Deliplus ya está aquí y no viene sola,Deliplus,None,None,None
CaixaBank rebaja a la mitad el interés fijo de su hipoteca pero solo para vivienda habitual,CaixaBank,CaixaBank,nsubj,ORG
La luz cierra este lunes enero con un descenso del   hasta  eurosMWh,La luz,luz,nsubj,OTHER
El IPC baja cinco décimas en enero y se sitúa en el  por el menor coste de la electricidad,El IPC,IPC,nsubj,OTHER
LA BANCA ANTE LA JUSTICIA DE LA UE,LA BANCA,None,None,None
Indra refuerza la seguridad en superficie en dos grandes aeropuertos de Corea del Sur,Indra,Indra,nsubj,ORG
Banco Popular,Banco Popular,None,None,None
Banxico De la quiebra en el error de diciembre a acumular  mil mdd en  años,Banxico,None,None,None
El lavado de cara a los impuestos que permitiría a España crecer más y crear más empleo según el IEE,España,None,None,None
El pájaro de Darwin y la economía zombi,economía zombi,None,None,None
La cartera de cuero de Lidl por  euros que se agota en horas,Lidl,None,None,None
